A1: HỘI ÁI HỮU | G1: QUỸ GIÁO DỤC HUẾ HIẾU HỌC
A2: QUỐC HỌC-ĐỒNG KHÁNH NAM CALI | G2: Webite : http://www.huehieuhoc.com/
A3: P.O.Box 936, Placentia, CA92870, USA | G3: email : mailto:baoan@huehieuhoc.com?subject=Hoc Bổng QH ĐK Nam Cali Hoa Kỳ năm 2006
A4: Điện thoại : (714)724-2566
A5: email: hocbongqhdk@yahoo.com
A6: DANH SÁCH SINH VIÊN XIN CẤP HỌC BỔNG TẠI HUẾ
A7: NĂM HỌC 2006-2007
A8: STT | B8: HỌ VÀ TÊN | C8: Giới tính | D8: Năm sinh | E8: Địa chỉ thường trú | F8: ĐT nhà | G8: ĐTLL | H8: SV năm thứ | I8: Tên trường ĐH | J8: Điểm | P8: Tổng thu nhập | Q8: Số người trong gia đình | R8: Số lao động chính
J9: Lớp 12 | K9: TN cấp 3 | L9: Đại Học | M9: Thu nhập | N9: Thu nhập | O9: Nghề nghiệp
A10: 1 | B10: Đinh thị thu Hồng | C10: nữ | D10: 31778 | E10: Hương sơ Huế | F10: 538974 | G10: 538974 | H10: 1 | I10: ĐH KH | J10: 6.9 | K10: 44.3 | L10: 23.5 | O10: LR,LR | P10: =M11+N11 -> 900000 | Q10: 7 | R10: 4
A11: 2 | B11: Dương thị thuỳ Trang | C11: nữ | D11: 32174 | E11: 02/kiệt 8 lương Y | G11: 512892 | H11: 1 | I11: ĐH NN | J11: 7.8 | K11: 41.5 | L11: 14.5 | N11: 900000 | O11: 0,NT | P11: =M12+N12 -> 1000000 | Q11: 5 | R11: 1
A12: 3 | B12: Trần thị thanh Huyền | C12: nữ | D12: 32471 | E12: Phú mậu – Phú Vang | F12: 983055 | H12: 1 | I12: ĐHKT | J12: 7.6 | K12: 46.5 | L12: 22.5 | M12: 500000 | N12: 500000 | O12: LR,LR | P12: =M13+N13 -> 0 | Q12: 7 | R12: 3
A13: 4 | B13: Phạm thị Hạnh | C13: nữ | D13: 32061 | E13: Phong Điền TT Huế | F13: 561524 | G13: 561524 | H13: 1 | I13: ĐH Y | J13: 7.8 | K13: 48.5 | L13: 18.5 | O13: LR,LR | P13: =M14+N14 -> 1600000 | Q13: 6 | R13: 4
A14: 5 | B14: Đoàn thuỳ Trang | C14: nữ | D14: 32153 | E14: Hương Thuỷ | F14: 863021 | H14: 1 | I14: DLPX | J14: 6.9 | K14: 46.5 | L14: 15 | M14: 1600000 | O14: Huu,NT | P14: =M15+N15 -> 1500000 | Q14: 7 | R14: 3
A15: 6 | B15: Lê hoàng quang minh | C15: N | D15: 32362 | E15: Hương Trà | F15: 567211 | H15: 1 | I15: ĐH KH | J15: 7.2 | K15: 50.5 | L15: 18 | M15: 1500000 | O15: KS,NT | P15: =M16+N16 -> 200000 | Q15: 6 | R15: 1
A16: 7 | B16: Trịnh minh Dũng | C16: N | D16: 32418 | E16: Phong Điền | F16: 514066 | H16: 1 | I16: ĐH SP | J16: 7.8 | K16: 46.5 | L16: 21.5 | M16: 100000 | N16: 100000 | O16: LR,LR | P16: =M17+N17 -> 0 | Q16: 9 | R16: 6
A17: 8 | B17: Phạm thị Nhung | C17: nữ | D17: 32103 | E17: Hương trà | G17: 828512 | H17: 1 | I17: ĐHKH | L17: 15.5 | O17: LR,LR | P17: =M18+N18 -> 450000 | Q17: 5 | R17: 2
A18: 9 | B18: Hồ thế Vũ | C18: N | D18: 32009 | E18: Quảng Điền | G18: 814362 | H18: 1 | I18: ĐHSP | J18: 7 | K18: 48 | L18: 17.5 | M18: 250000 | N18: 200000 | O18: LR,LR | P18: =M19+N19 -> 250000 | Q18: 7 | R18: 2
A19: 10 | B19: Mai thị diệu Nga | C19: nữ | D19: 32184 | E19: Phú Lộc | F19: 546283 | H19: 1 | I19: ĐHSP | J19: 7.7 | K19: 49.5 | L19: 17.5 | M19: 100000 | N19: 150000 | O19: HT,Bb | P19: =M20+N20 -> 600000 | Q19: 7 | R19: 5
A20: 11 | B20: Mai bá HảI | C20: N | D20: 32184 | E20: Quảng Điền | G20: 569249 | H20: 1 | I20: ĐHY | J20: 7.9 | K20: 47 | L20: 23 | M20: 600000 | O20: LR,LR | P20: =M21+N21 -> 900000 | Q20: 5 | R20: 2
A21: 12 | B21: Trần thị hoàng Oanh | C21: nữ | D21: 32328 | E21: Phú Vang | G21: 960473 | H21: 1 | I21: ĐHY | J21: 8.3 | K21: 54 | L21: 21.5 | M21: 600000 | N21: 300000 | O21: LR,LR | P21: =M22+N22 -> 500000 | Q21: 5 | R21: 2
A22: 13 | B22: Nguyễn thị hoài Trang | C22: nữ | D22: 31932 | E22: 12/105 Lê ngô Cát | F22: 887249 | H22: 1 | I22: ĐHSP | J22: 7.8 | K22: 51 | L22: 18.5 | N22: 500000 | O22: ?,bb | P22: =M23+N23 -> 600000 | Q22: 7 | R22: 4
A23: 14 | B23: Nguyễn thị yến Liễu | C23: nữ | D23: 31093 | E23: Phong Điền | G23: 825678 | H23: 1 | I23: ĐHSP | J23: 7.1 | K23: 42 | L23: 22 | M23: 300000 | N23: 300000 | O23: LR,LR | P23: =M24+N24 -> 1100000 | Q23: 9 | R23: 1
A24: 15 | B24: Hồ Thị Phương | C24: nữ | D24: 31753 | E24: A Lưới | G24: 919507405 | H24: 1 | I24: ĐHSP | J24: 7.5 | K24: 39 | L24: DB | M24: 1000000 | N24: 100000 | O24: Huu,LR | P24: =M25+N25 -> 500000 | Q24: 6 | R24: 1
A25: 16 | B25: Tôn Nữ thanh Chi | C25: nữ | D25: 32067 | E25: 8/4/43 Yết kiêu Huế | H25: 1 | I25: ĐHSP | J25: 6.8 | K25: 45 | L25: 19.5 | M25: 500000 | O25: LD | P25: =M26+N26 -> 300000 | Q25: 4 | R25: 1
A26: 17 | B26: Hoàng thế Ngân | C26: N | D26: 32393 | E26: Quảng Điền | G26: 907335381 | H26: 1 | I26: ĐHSP | J26: 7 | K26: 37.5 | L26: 15 | M26: 150000 | N26: 150000 | O26: LR,LR | P26: =M27+N27 -> 300000 | Q26: 5 | R26: 3
A27: 18 | B27: Hoàng Thị Hường | C27: nữ | D27: 32418 | E27: Phú Lộc | H27: 1 | I27: ĐHSP | J27: 7.7 | K27: 46 | L27: 18.5 | N27: 300000 | O27: bb | P27: =M28+N28 -> 450000 | Q27: 6 | R27: 2
A28: 19 | B28: Nguyễn Văn Khuyên | C28: N | D28: 32076 | E28: Phong Điền | G28: 527087 | H28: 1 | I28: ĐHKH | J28: 7.6 | K28: 52.5 | L28: 21.5 | M28: 250000 | N28: 200000 | O28: LR,LR | P28: =M29+N29 -> #VALUE! | Q28: 7 | R28: 5
A29: 20 | B29: Lê thị Thuý | C29: nữ | D29: 32027 | E29: Hưong Trà | G29: 779342 | H29: 1 | I29: ĐHNN | J29: 7.6 | K29: 44.5 | L29: 21 | M29: thấp | O29: LR,LR | Q29: 6 | R29: 2
A30: 21 | B30: Hồ thị Tâm | C30: nữ | D30: 31943 | E30: Quảng Điền | G30: 813647 | H30: 1 | I30: ĐHSP | J30: 7.2 | K30: 42.5 | L30: 18 | O30: LR,LR | P30: =M31+N31 -> 550000 | Q30: 5 | R30: 3
A31: 22 | B31: Hồ thị Ân | C31: nữ | D31: 32423 | E31: Hương Trà | G31: 569795 | H31: 1 | I31: ĐHSP | J31: 7.1 | K31: 47 | L31: 18.5 | M31: 300000 | N31: 250000 | O31: LR,LR | P31: =M32+N32 -> 600000 | Q31: 6 | R31: 2
A32: 23 | B32: Nguyễn thị Quý Hoa | C32: nữ | D32: 32225 | E32: 5/15 Xuân Diệu | F32: 887699 | H32: 1 | I32: ĐHSP | J32: 7.4 | K32: 48 | L32: 14.5 | N32: 600000 | O32: 0,CNV | P32: =M33+N33 -> 0 | Q32: 5 | R32: 2
A33: 24 | B33: Nguyễn Hoàng Đạo | C33: N | D33: 32157 | E33: Quảng Điền | G33: 510427 | H33: 1 | I33: ĐHKT | J33: 7 | K33: 47.5 | L33: 18.5 | O33: 0,TT | P33: =M34+N34 -> 0 | Q33: 4 | R33: 2
A34: 25 | B34: Hoàng thu Dạ Vũ | C34: N | D34: 32440 | E34: Quảng Điền | H34: 1 | I34: ĐHYK | J34: 8.2 | K34: 53 | L34: 26.5 | O34: LR,LR | P34: =M35+N35 -> 0 | Q34: 4 | R34: 2
A35: 26 | B35: Hồ thị Thanh Hoàng | C35: nữ | D35: 31600 | E35: Phong Điền | G35: 514371 | H35: 1 | I35: ĐHSP | K35: 45.5 | L35: 18 | O35: 0,LR | P35: =M36+N36 -> 0 | Q35: 5 | R35: 2
A36: 27 | B36: Nguyễn Văn Mừng | C36: N | D36: 32121 | E36: Hương Thuỷ | G36: 864660 | H36: 1 | I36: GDTC | J36: 6.7 | K36: 39.5 | L36: 22 | O36: 0,BB | P36: =M37+N37 -> 600000 | Q36: 2 | R36: 1
A37: 28 | B37: Phạm Thị Hoài Ngân | C37: nữ | D37: 32250 | E37: 174 Phan chu trinh | F37: 830586 | H37: 1 | I37: ĐHNN | J37: 7.1 | K37: 43 | L37: 18 | N37: 600000 | O37: 0,BB | P37: =M38+N38 -> 0 | Q37: 5 | R37: 1
A38: 29 | B38: Lê nguyễn ngọc Phương | C38: nữ | D38: 32283 | E38: Hương Trà | G38: 569143 | H38: 1 | I38: ĐHNN | J38: 7.1 | K38: 48.5 | L38: 22 | O38: LR,LR | P38: =M39+N39 -> 300000 | Q38: 6 | R38: 2
A39: 30 | B39: Nguyễn Thành Trung | C39: N | D39: 32304 | E39: Hương Trà | F39: 567946 | H39: 1 | I39: ĐHY | J39: 8.9 | K39: 53.5 | L39: 24 | N39: 300000 | O39: B,Bb | P39: =M40+N40 -> 500000 | Q39: 4 | R39: 1
A40: 31 | B40: Ngô Thị Kiều My | C40: nữ | D40: 32372 | E40: Quảng Điền | G40: 814035 | H40: 1 | I40: ĐHY | J40: 7.5 | K40: 47 | L40: 21 | M40: 250000 | N40: 250000 | O40: TT,TT | P40: =M41+N41 -> 750000 | Q40: 5 | R40: 2
A41: 32 | B41: Trần nhật Huy | C41: N | D41: 32185 | E41: 100LươngNgocQuyến | H41: 1 | I41: ĐHY | J41: 7.8 | K41: 47.5 | L41: 23.5 | N41: 750000 | O41: 0,bb | P41: =M42+N42 -> 800000 | Q41: 3 | R41: 1
A42: 33 | B42: Võ thanh Sang | C42: N | D42: 31424 | E42: Quảng Điền | G42: 565216 | H42: 1 | I42: ĐHNL | J42: 5.6 | K42: 37 | L42: 14 | M42: 500000 | N42: 300000 | O42: Cá,BB | P42: =M43+N43 -> 400000 | Q42: 4 | R42: 3
A43: 34 | B43: Võ Diệu kim Trâm | C43: nữ | D43: 32326 | E43: Hương thuỷ | H43: 1 | I43: ĐHNN | J43: 7.4 | K43: 44.5 | L43: 15 | N43: 400000 | O43: Huu,LR | P43: =M44+N44 -> 0 | Q43: 5 | R43: 2
A44: 35 | B44: Trần thị Yến | C44: nữ | D44: 32077 | E44: ALưới | G44: 914480650 | H44: 1 | I44: ĐHNN | K44: 33.5 | L44: 19 | O44: 0,May | P44: =M45+N45 -> 900000 | Q44: 4 | R44: 1
A45: 36 | B45: Nguyễn thị Bích Hương | C45: nữ | D45: 32437 | E45: 32/10NguyễnTrườngTộ | G45: 831105 | H45: 1 | I45: ĐHNN | J45: 7.1 | K45: 47.5 | L45: 15.5 | M45: 700000 | N45: 200000 | O45: Thồ,Nón | P45: =M46+N46 -> 700000 | Q45: 6 | R45: 2
A46: 37 | B46: Tào thị Thuý Mai | C46: nữ | D46: 32144 | E46: Hương Long | F46: 519901 | H46: 1 | I46: ĐHSP | J46: 7.9 | K46: 48 | L46: 21.5 | M46: 350000 | N46: 350000 | O46: LR,LR | P46: =M47+N47 -> #VALUE! | Q46: 7 | R46: 4
A47: 38 | B47: Lê kim Hồng | C47: N | D47: 32355 | E47: Hương Trà | G47: 569096 | H47: 1 | I47: ĐHY | J47: 8 | K47: 45.5 | L47: 25.5 | M47: Bấp bênh | O47: LR,LR | Q47: 7 | R47: 5
A48: 39 | B48: Nguyễn Bé | C48: N | D48: 27322 | E48: Hương Thuỷ | G48: 864359 | H48: 1 | I48: ĐHNT | K48: 48 | L48: 32 | M48: 200000 | N48: 150000 | O48: LR,NT | P48: =M49+N49 -> 800000 | Q48: 5 | R48: 4
A49: 40 | B49: Lê Văn Khuyên | C49: N | D49: 32077 | E49: Hương Trà | H49: 1 | I49: ĐHSP | J49: 8.3 | K49: 52.5 | L49: 21 | M49: 400000 | N49: 400000 | O49: TT,bb | P49: =M50+N50 -> 700000 | Q49: 6 | R49: 2
A50: 41 | B50: Hà Văn Trực | C50: N | D50: 32427 | E50: Phú vang | G50: 589709 | H50: 1 | I50: ĐHSP | J50: 7.9 | K50: 52 | L50: 23 | M50: 300000 | N50: 400000 | O50: LR,CD | P50: =M51+N51 -> 300000 | Q50: 4 | R50: 2
A51: 42 | B51: Hoàng thị Mỹ Hạnh | C51: nữ | D51: 32136 | E51: Phong Điền | F51: 580724 | H51: 1 | I51: ĐHSP | J51: 7.6 | K51: 48 | L51: 16.5 | N51: 300000 | O51: ?,LR | P51: =M52+N52 -> 350000 | Q51: 3 | R51: 1
A52: 43 | B52: Huỳnh thị Thuỷ | C52: nữ | D52: 32344 | E52: Phú Vang | G52: 815374 | H52: 1 | I52: ĐHSP | J52: 6.3 | K52: 46.5 | L52: 17 | N52: 350000 | O52: ?,LR | P52: =M53+N53 -> 1200000 | Q52: 6 | R52: 2
A53: 44 | B53: Huỳnh Đại Dương | C53: N | D53: 31783 | E53: 1/1kiệt489 Bùi thị xuân | G53: 882545 | H53: 1 | I53: GDTC | J53: 6.7 | K53: 37.5 | L53: 18.5 | M53: 1200000 | O53: Nề,? | P53: =M54+N54 -> 0 | Q53: 6 | R53: 1
A54: 45 | B54: Hồ thế Nhĩ | C54: N | D54: 32091 | E54: Quảng Điền | G54: 538167 | H54: 1 | I54: GDTC | J54: 6.3 | K54: 39 | L54: 17 | O54: LR,LR | P54: =M55+N55 -> 0 | Q54: 6 | R54: 4
A55: 46 | B55: Lê thị Phước Thành | C55: nữ | D55: 32485 | E55: 08 Nguyễn chí Thanh | G55: 512654 | H55: 1 | I55: GDTC | K55: 41.5 | L55: 21.5 | O55: Huu,NT | P55: =M56+N56 -> 400000 | Q55: 7 | R55: 2
A56: 47 | B56: Ngô Thị Cẩm Hương | C56: nữ | D56: 32143 | E56: Hương Thuỷ TT H | G56: 833130 | H56: 1 | I56: ĐHKH | J56: 6.9 | K56: 42 | L56: 16.5 | N56: 400000 | O56: MS,bb | P56: =M57+N57 -> 250000 | Q56: 6 | R56: 2
A57: 48 | B57: Nguyễn Văn Tuấn | C57: N | D57: 32150 | E57: Hương Sơ | G57: 589659 | H57: 1 | I57: DLPX | J57: 6.7 | K57: 44 | L57: 15 | N57: 250000 | O57: chai bao | P57: =M58+N58 -> 250000 | Q57: 2 | R57: 1
A58: 49 | B58: Văn Bùi Vũ | C58: N | D58: 32121 | E58: Phú Vang | G58: 812443 | H58: 1 | I58: ĐHSP | J58: 7.2 | K58: 43.5 | L58: 19.5 | N58: 250000 | O58: ?,LR | P58: =M59+N59 -> 300000 | Q58: 3 | R58: 2
A59: 50 | B59: Trần thị Bảo Nhung | C59: nữ | D59: 31985 | E59: Hương Trà | F59: 567140 | H59: 1 | I59: ĐHNN | J59: 8.1 | K59: 53 | L59: 18.5 | M59: 150000 | N59: 150000 | O59: LR,LR | P59: =M60+N60 -> 0 | Q59: 10 | R59: 7
A60: 51 | B60: Trần thị Hoàng Oanh | C60: nữ | D60: 32410 | E60: 40 Lương Ngọc Quyến | H60: 1 | I60: ĐHNL | J60: 7 | K60: 42.5 | L60: 14 | N60: 0 | O60: ?,BB | Q60: 3 | R60: 1
A61: 52 | B61: Dưong Văn Dành | C61: N | D61: 31837 | E61: Hương Thuỷ | H61: 1 | I61: ĐHNL | J61: 7.2 | K61: 7.5 | L61: 13.5 | O61: 0,LR | P61: =M62+N62 -> 200000 | Q61: 8 | R61: 4
A62: 53 | B62: Lê ngọc Dương | C62: N | D62: 32147 | E62: Quảng Điền | G62: 514738 | H62: 1 | I62: ĐHNL | J62: 6.7 | K62: 38.5 | L62: 13.5 | M62: 200000 | O62: LR,? | P62: =M63+N63 -> 0 | Q62: 6 | R62: 2
A63: 54 | B63: Phạm Văn Phú | C63: N | D63: 32247 | E63: Hương Trà | G63: 558435 | H63: 1 | I63: ĐHSP | J63: 7.3 | K63: 49 | L63: 21.5 | O63: TT | P63: =M64+N64 -> 400000 | Q63: 5 | R63: 3
A64: 55 | B64: Trần thị Khánh Trà | C64: nữ | D64: 32348 | E64: Hương Trà | G64: 828864 | H64: 1 | I64: ĐHSP | J64: 7.6 | K64: 50 | L64: 19 | N64: 400000 | O64: ?,LR | P64: =M65+N65 -> 1500000 | Q64: 7 | R64: 4
A65: 56 | B65: Nguyễn Hoàng….(Cha chết, Me nuôi Ông và Bà) | C65: nữ | D65: 32185 | E65: 116/16NguyễnLộTrạch | F65: 813548 | H65: 1 | I65: DLPX | J65: 6.1 | K65: 46.5 | L65: 15 | N65: 1500000 | O65: ?,GV | P65: =M66+N66 -> 700000 | Q65: 4 | R65: 1
A66: 57 | B66: Trần Hiếu Lễ | C66: N | D66: 32143 | E66: Quảng Điền | G66: 522392 | H66: 1 | I66: DLPX | J66: 5.5 | K66: 41 | L66: 15 | M66: 250000 | N66: 450000 | O66: Tm,Tm | P66: =M67+N67 -> 450000 | Q66: 5 | R66: 4
A67: 58 | B67: Nguyển thị thu Hằng | C67: nử | D67: 32305 | E67: Phú vang | H67: 1 | I67: DLPX | J67: 6.7 | K67: 40 | L67: 14.75 | M67: 350000 | N67: 100000 | O67: Ym,LR | P67: =M68+N68 -> 500000 | Q67: 7 | R67: 2
A68: 59 | B68: Tần ĐạI Phụng | C68: N | D68: 32165 | E68: Phú Vang | H68: 1 | I68: ĐH KH | J68: 8.5 | K68: 51 | L68: 20.5 | M68: 300000 | N68: 200000 | O68: LR,Nón | P68: =M69+N69 -> 450000 | Q68: 5 | R68: 2
A69: 60 | B69: Trần đức Minh | C69: N | D69: 32282 | E69: Quảng Điền | G69: 565332 | H69: 1 | I69: ĐHY | J69: 7.5 | K69: 7.58 | L69: 23 | M69: 250000 | N69: 200000 | O69: LR,LR | P69: =M70+N70 -> 0 | Q69: 6 | R69: 2
A70: 61 | B70: Đào thị tường Vi | C70: nữ | D70: 32017 | E70: Quãng Điền | G70: 812708 | H70: 1 | I70: ĐHSP | K70: 41.5 | L70: 19 | O70: ?,? | P70: =M71+N71 -> 300000 | Q70: 4 | R70: 2
A71: 62 | B71: Lê thị thanh Tâm | C71: nữ | D71: 32142 | E71: Phú Lộc | G71: 822779 | H71: 1 | I71: ĐHKH | J71: 7.4 | K71: 40.5 | L71: 15.5 | N71: 300000 | O71: ?,NT | P71: =M72+N72 -> 500000 | Q71: 3 | R71: 2
A72: 63 | B72: Hồ vũ thảo Tiên | C72: nữ | D72: 32322 | E72: Phú Lộc | G72: 691515 | H72: 1 | I72: ĐHKH | J72: 7.7 | K72: 47 | L72: 23 | M72: 100000 | N72: 400000 | O72: LR,CD | P72: =M73+N73 -> 450000 | Q72: 6 | R72: 2
A73: 64 | B73: Ngô Quang Hoàng | C73: N | D73: 31602 | E73: 111 Nguyễn Trãi | G73: 514636 | H73: 1 | I73: ĐHKH | K73: 42 | L73: 18.5 | N73: 450000 | O73: bb | P73: =M74+N74 -> 0 | Q73: 5 | R73: 2
A74: 65 | B74: Nguyễn Văn Nam | C74: N | D74: 31345 | E74: Phú Vang | G74: 860669 | H74: 1 | I74: ĐHKH | J74: 7.8 | K74: 46.5 | L74: 18.5 | O74: LR,Bc | P74: =M75+N75 -> 0 | Q74: 6 | R74: 2
A75: 66 | B75: Hoàng thị Nhân | C75: nữ | D75: 32001 | E75: Quảng Điền | G75: 849275 | H75: 1 | I75: ĐHKH | J75: 6.4 | K75: 35.5 | L75: 15.5 | O75: ?,TT | P75: =M76+N76 -> 240000 | Q75: 5 | R75: 4
A76: 67 | B76: Lê thị Thanh Phước | C76: nữ | D76: 32070 | E76: Hương thuỷ | G76: 853279 | H76: 1 | I76: DLPX | J76: 6.9 | K76: 41.5 | L76: 15.5 | N76: 240000 | O76: LR,Nón | P76: =M77+N77 -> 0 | Q76: 3 | R76: 2
A77: 68 | B77: Nguyễn Văn Kim | C77: N | D77: 31402 | E77: Phú Lộc | G77: 984073219 | H77: 1 | I77: DLPX | J77: 6.4 | K77: 41.5 | L77: 16.5 | O77: ?,LR | P77: =M78+N78 -> 850000 | Q77: 3 | R77: 1
A78: 69 | B78: Trần Hiếu Liêm | C78: N | D78: 31996 | E78: Quảng Điền | G78: 522392 | H78: 1 | I78: DLPX | J78: 6 | K78: 41 | L78: 15.25 | M78: 450000 | N78: 400000 | O78: BB,bb | P78: =M79+N79 -> 300000 | Q78: 5 | R78: 2
A79: 70 | B79: Đinh Thị Lệ Phương | C79: nữ | D79: 31742 | E79: A Lưới | F79: 877193 | G79: 895210 | H79: 1 | I79: DLPX | J79: 5.3 | K79: 32.5 | L79: 14 | N79: 300000 | O79: TT,TT | P79: =M80+N80 -> 900000 | Q79: 8 | R79: 2
A80: 71 | B80: Nguyễn Tân Hợp | C80: N | D80: 31269 | E80: Quảng Điền | G80: 554058 | H80: 1 | I80: DLPX | J80: 6.4 | K80: 36.5 | L80: 16.5 | M80: 900000 | O80: Dcá,Lr | P80: =M81+N81 -> 1760000 | Q80: 7 | R80: 1
A81: 72 | B81: Nguyễn thuỷ Phương Liên | C81: nữ | D81: 32282 | E81: Hương thuỷ | F81: 861711 | H81: 1 | I81: DLPX | J81: 7.3 | K81: 7.58 | L81: 14 | M81: 1300000 | N81: 460000 | O81: Huu,B | P81: =M82+N82 -> 1800000 | Q81: 6 | R81: 3
A82: 73 | B82: Nguyễn thị Nhung | C82: nữ | D82: 32471 | E82: A Lưới | F82: 878629 | H82: 1 | I82: DLPX | J82: 7.1 | K82: 5.33 | L82: 14.5 | M82: 1500000 | N82: 300000 | O82: CB.LR | P82: =M83+N83 -> 820000 | Q82: 5 | R82: 2
A83: 74 | B83: Trần thị Nhi | C83: nữ | D83: 31565 | E83: A Lưới | H83: 1 | I83: DLPX | J83: 7.1 | K83: 36.5 | L83: 16 | N83: 820000 | O83: ,BB | P83: =M84+N84 -> 375000 | Q83: 8 | R83: 3
A84: 75 | B84: Đỗ thị Mỹ Thuý | C84: nữ | D84: 31503 | E84: Phong Điền | F84: 562603 | G84: 512600 | H84: 1 | I84: DLPX | L84: 18 | M84: 200000 | N84: 175000 | O84: TT,TT | P84: =M85+N85 -> 300000 | Q84: 8 | R84: 2
A85: 76 | B85: Hoàng thị Kim Liên | C85: nữ | D85: 32379 | E85: Phú Vang | H85: 1 | I85: DLPX | J85: 6.8 | K85: 45 | L85: 14.5 | N85: 300000 | O85: LR,LR | P85: =M86+N86 -> 700000 | Q85: 7 | R85: 3
A86: 77 | B86: Nguyễn thị hoài Phương | C86: nữ | D86: 31819 | E86: 138 Trần quốc Toản | F86: 536242 | H86: 1 | I86: ĐHNN | J86: 8 | K86: 52.5 | L86: 22 | M86: 700000 | O86: CN,? | P86: =M87+N87 -> 1800000 | Q86: 4 | R86: 1
A87: 78 | B87: Phạm Nguyên Tuấn Hải | C87: N | D87: 32256 | E87: 2/592 Lê Duẩn | F87: 580699 | H87: 1 | I87: ĐHSP | J87: 8.4 | K87: 50 | L87: 20 | M87: 600000 | N87: 1200000 | O87: ThồGV | P87: =M88+N88 -> 500000 | Q87: 5 | R87: 2
A88: 79 | B88: Nguyễn chí Thìn | C88: N | D88: 32178 | E88: Phú Vang | G88: 581896 | H88: 1 | I88: ĐHSP | J88: 8.7 | K88: 52 | L88: 23 | M88: 300000 | N88: 200000 | O88: LR,LR | P88: =M89+N89 -> 550000 | Q88: 6 | R88: 2
A89: 80 | B89: Lâm thị Thạnh | C89: nữ | D89: 32491 | E89: 88 Bùi thị Xuân | G89: 882242 | H89: 1 | I89: ĐHSP | J89: 7.1 | K89: 50 | L89: 15.5 | N89: 550000 | O89: ?,BB | P89: =M90+N90 -> 500000 | Q89: 6 | R89: 1
A90: 81 | B90: Lê thị Ý | C90: nữ | D90: 32424 | E90: Phú Vang | F90: 845536 | H90: 1 | I90: ĐHSP | J90: 7.1 | K90: 48 | L90: 19 | M90: 300000 | N90: 200000 | O90: LR,LR | P90: =M91+N91 -> 600000 | Q90: 5 | R90: 3
A91: 82 | B91: Bạch thị Nguyệt | C91: nữ | D91: 32314 | E91: Phú Lộc | G91: 877398 | H91: 1 | I91: ĐHSP | J91: 8.4 | K91: 52 | L91: 17.5 | M91: 300000 | N91: 300000 | O91: LR,LR | P91: =M92+N92 -> 3000000 | Q91: 6 | R91: 2
A92: 83 | B92: Nguyễn thị Minh Thành | C92: nữ | D92: 32391 | E92: Phong Điền | G92: 581037 | H92: 1 | I92: ĐHY | J92: 8.5 | K92: 48 | L92: 24 | M92: 1500000 | N92: 1500000 | O92: GV,GV | P92: =M93+N93 -> 0 | Q92: 5 | R92: 2
A93: 84 | B93: Văn Phước Công Thành | C93: N | D93: 32147 | E93: Phong Điền | G93: 561423 | H93: 1 | I93: GDTC | J93: 7.1 | K93: 45 | L93: 18.5 | O93: LR,GV | P93: =M94+N94 -> 3000000 | Q93: 4 | R93: 2
A94: 85 | B94: Nguyễn Duy Nam Anh | C94: N | D94: 32275 | E94: Hương Thuỷ | G94: 854952 | H94: 1 | I94: ĐHY | J94: 8.7 | K94: 54 | L94: 23 | M94: 1500000 | N94: 1500000 | O94: GV,GV | P94: =M95+N95 -> 1500000 | Q94: 4 | R94: 2
A95: 86 | B95: Hà Thúc Đạt | C95: N | D95: 32023 | E95: 66 Tuệ Tĩnh | G95: 515126 | H95: 1 | I95: DLPX | J95: 6.7 | K95: 43.5 | L95: 14.5 | M95: 1200000 | N95: 300000 | O95: CgC,GV | P95: =M96+N96 -> 2000000 | Q95: 5 | R95: 2
A96: 87 | B96: Hồ Đắc Thiện Tân | C96: N | D96: 31927 | E96: Phú Vang | F96: 850839 | H96: 1 | I96: ĐHKH | J96: 8 | K96: 49.5 | L96: 21 | M96: 1000000 | N96: 1000000 | O96: GV,GV | P96: =M97+N97 -> 700000 | Q96: 6 | R96: 2
A97: 88 | B97: Nguyễn thị Nhơn | C97: nữ | D97: 32349 | E97: Phong Điền | G97: 812715 | H97: 1 | I97: ĐHSP | J97: 8.7 | K97: 51 | L97: 23.5 | M97: 400000 | N97: 300000 | O97: LR,LR | P97: =M98+N98 -> 550000 | Q97: 7 | R97: 2
A98: 89 | B98: Nguyễn Đình Ánh | C98: N | D98: 32147 | E98: Quảng Điền | F98: 555562 | G98: 736044 | H98: 1 | I98: ĐHBK | J98: 7.4 | K98: 52.5 | L98: 20 | M98: 300000 | N98: 250000 | O98: LR,LR | P98: =M99+N99 -> 0 | Q98: 6 | R98: 2
A99: 90 | B99: Trần thị Kim Vui | C99: nữ | D99: 32479 | E99: Quảng Điền | G99: 832960 | H99: 1 | I99: ĐHSP | J99: 7.3 | K99: 50 | L99: 17 | O99: LR,LR | P99: =M100+N100 -> #VALUE! | Q99: 5 | R99: 2
A100: 91 | B100: Nguyễn chí Duyên | C100: N | D100: 31777 | E100: Quảng Điền | H100: 1 | I100: ĐHNN | J100: 7.2 | K100: 45 | L100: 18 | M100: thấp | O100: LR,LR | Q100: 6 | R100: 3
A101: 92 | B101: Nguyễn thế Phúc | C101: N | D101: 32351 | E101: Hương Trà | G101: 529849 | H101: 1 | I101: ĐHSP | J101: 8.2 | K101: 49 | L101: 20 | M101: 300000 | N101: 250000 | O101: LR,LR | P101: =M102+N102 -> 400000 | Q101: 9 | R101: 6
A102: 93 | B102: Nguyễn Khắc Thành | C102: N | D102: 32470 | E102: Quảng Điền | H102: 1 | I102: ĐHKH | J102: 6.3 | K102: 50 | L102: 15 | M102: 200000 | N102: 200000 | O102: LR,LR | P102: =M103+N103 -> 300000 | Q102: 7 | R102: 4
A103: 94 | B103: Nguyễn thị Thu Huyền | C103: nữ | D103: 32356 | E103: Phú Lộc | G103: 691568 | H103: 1 | I103: ĐHSP | J103: 8 | K103: 41.5 | L103: 20 | N103: 300000 | O103: B,bb | P103: =M104+N104 -> 600000 | Q103: 6 | R103: 3
A104: 95 | B104: Nguyễn thị Lành | C104: nữ | D104: 32250 | E104: Phú Vang | G104: 850607 | H104: 1 | I104: ĐHSP | J104: 8.2 | K104: 7.75 | L104: 21 | M104: 300000 | N104: 300000 | O104: LR,NT | P104: =M105+N105 -> 400000 | Q104: 8 | R104: 3
A105: 96 | B105: Lê thị Thanh My | C105: nữ | D105: 31800 | E105: Phú Lộc | G105: 876555 | H105: 1 | I105: DLPX | J105: 6.7 | K105: 38 | L105: 13.5 | M105: 100000 | N105: 300000 | O105: LR,LR | P105: =M106+N106 -> 550000 | Q105: 5 | R105: 2
A106: 97 | B106: Hồ thị Thu Hương | C106: nữ | D106: 32504 | E106: Quảng Điền | G106: 916481754 | H106: 1 | I106: ĐHSP | J106: 7.6 | K106: 48.5 | L106: 20.5 | M106: 300000 | N106: 250000 | O106: LR,LR | P106: =M107+N107 -> 500000 | Q106: 7 | R106: 2
A107: 98 | B107: Hoàng Trọng Chinh | C107: N | D107: 32058 | E107: Phú Vang | F107: 890218 | H107: 1 | I107: ĐHSP | J107: 7.2 | K107: 49.5 | L107: 18.5 | M107: 500000 | O107: LR,NT | P107: =M108+N108 -> 0 | Q107: 5 | R107: 1
A108: 99 | B108: Hồ thị Hồng Tuyến | C108: nữ | D108: 31833 | E108: Hương Trà | G108: 558772 | H108: 1 | I108: ĐHSP | J108: 7.3 | L108: 16.5 | O108: LR,LR | P108: =M109+N109 -> 300000 | Q108: 4 | R108: 2
A109: 100 | B109: Nguyễn Tấn Phước | C109: N | D109: 32337 | E109: Hương Long | H109: 1 | I109: ĐHSP | J109: 8.1 | K109: 48.5 | L109: 25.5 | M109: 200000 | N109: 100000 | O109: LR,LR | P109: =M110+N110 -> #VALUE! | Q109: 6 | R109: 3
A110: 101 | B110: Nguyễn Hoàng Long | C110: N | D110: 88 | E110: Hưong Thuỷ TTH | F110: 861401 | G110: Nha | H110: 1 | I110: ĐHKH | J110: 7.8 | K110: 48.5 | L110: 21.5 | M110: ? | O110: ?,BB | P110: 500000 | Q110: 6 | R110: 1
A111: 102 | B111: Lê Đình Hiếu | C111: N | D111: 87 | E111: Hưong Trà TTH | G111: A0985159593 | H111: 1 | I111: ĐHSP | J111: 7.1 | K111: 47.5 | L111: 19 | M111: 1.000,000 | O111: LR,LR | P111: 1300000 | Q111: 6 | R111: 3
A112: 103 | B112: Lê Thị Kim Chi | C112: Nữ | D112: 88 | E112: Hưong Trà TTH | F112: 512850 | G112: Nha | H112: 1 | I112: ĐHNN | J112: 7.4 | K112: 50.5 | L112: 18.5 | O112: LR,LR | Q112: 4 | R112: 2
A113: 104 | B113: Nguyễn T. Diệu Huyền | C113: Nữ | D113: 88 | E113: Hưong Tra TTH | F113: 569645 | G113: Nha | H113: 1 | I113: ĐHSP | J113: 7.9 | K113: 51.5 | L113: 19 | M113: 200000 | N113: 150000 | O113: LR,LR | P113: 350000 | Q113: 6 | R113: 3
A114: 105 | B114: Nguyễn Đăng Báu | C114: N | D114: 88 | E114: Hưong Trà TTH | H114: 1 | I114: ĐHSP | J114: 7.3 | K114: 47 | L114: 21.5 | O114: LR,LR | Q114: 7 | R114: 4
A115: 106 | B115: Trần Hưũ Thắng | C115: N | D115: 86 | E115: Quảng Điền TTH | F115: 565212 | G115: Cạnh Nhà | H115: 1 | I115: DLPX | J115: 6.8 | K115: 39 | L115: 16.5 | M115: 350000 | N115: 350000 | O115: LR,LR | P115: 700000 | Q115: 6 | R115: 3
A116: 107 | B116: Nguyễn Thị Huệ | C116: Nữ | D116: 88 | E116: Hưong Thuỷ TTH | F116: 864567 | G116: Nhà | H116: 1 | I116: ĐHSP | J116: 7.8 | K116: 42 | L116: 17.5 | M116: 400000 | N116: 300000 | O116: LR,LR | P116: 700000 | Q116: 7 | R116: 2
A117: 108 | B117: Hồ Thanh Tuấn | C117: N | D117: 88 | E117: Phú Vang | F117: 859714 | G117: Cậu | H117: 1 | I117: ĐHSP | J117: 8.2 | K117: 46 | L117: 23.5 | O117: LR,LR | Q117: 6 | R117: 2
A118: 109 | B118: Nguyễn Thị Dung | C118: Nữ | D118: 88 | E118: 27/2 Nguyễn Huệ TTH | F118: 834536 | G118: Cạnh Nha | H118: 1 | I118: DLPX | J118: 6.9 | K118: 43 | L118: 14 | O118: Kx,NT | Q118: 3 | R118: 1
A119: 110 | B119: Mai Thị Hải Nguyên | C119: Nữ | D119: 88 | E119: Hưong Trà TTH | F119: 515748 | G119: Nhà | H119: 1 | I119: ĐHNN | J119: 7.2 | K119: 47 | L119: 14.5 | M119: 180000 | N119: 230000 | O119: LR,LR | P119: 410000 | Q119: 7 | R119: 3
A120: 111 | B120: Nguyễn Thị Lợi | C120: Nữ | D120: 88 | E120: Hưong Trà TTH | F120: 550782 | G120: Nhà | H120: 1 | I120: ĐHKH | J120: 7.3 | K120: 43 | L120: 24 | M120: 300000 | N120: 300000 | O120: LR,LR | P120: 600000 | Q120: 6 | R120: 3
A121: 112 | B121: Nguyễn Anh Lâm | C121: N | D121: 87 | E121: Hưong Thuỷ | F121: 865893 | G121: Cạnh Nhà | H121: 1 | I121: ĐHNL | J121: 7.6 | K121: 44 | L121: 22.5 | M121: 400000 | N121: 600000 | O121: LR,BB | P121: 1000000 | Q121: 6 | R121: 3
A122: 113 | B122: Hồ Nhật Trí | C122: N | D122: 88 | E122: Hùng Vưong TTH | F122: 812062 | G122: Nhà | H122: 1 | I122: ĐHKH | J122: 5.9 | K122: 42.5 | L122: 15 | M122: 15000 | N122: 15000 | O122: SủaX,Lr | P122: 30000 | Q122: 5 | R122: 2
A123: 114 | B123: Ng Thị Phưong Ngọc Thảo | C123: Nữ | D123: 88 | E123: 6/286 Đang Bạt Hổ TTH | F123: 580608 | G123: NHà | H123: 1 | I123: ĐHNN | J123: 7 | K123: 40.5 | L123: 16.5 | O123: bb,may | Q123: 6 | R123: 3
A124: 115 | B124: Phan Thanh Phú | C124: N | D124: 88 | E124: Phú Vang TTH | F124: 860613 | G124: nhà | H124: 1 | I124: ĐHSP | J124: 8 | K124: 44 | L124: 24 | O124: LR,LR | Q124: 6 | R124: 3
A125: 116 | B125: Trưong Thị Xuân Phưong | C125: Nữ | D125: 88 | E125: Vỹ Dạ | H125: 1 | I125: ĐHSP | J125: 8 | K125: 48.5 | L125: 24.5 | M125: 300000 | N125: 150000 | O125: ?,bb | P125: 450000 | Q125: 4 | R125: 2
A126: 117 | B126: Lê Thị Kim Anh | C126: Nữ | D126: 88 | E126: Phú Vang | F126: 869946 | G126: Cạnh Nhà | H126: 1 | I126: ĐHSP | J126: 8.1 | K126: 50 | L126: 25 | O126: LR,LR | Q126: 8 | R126: 2
A127: 118 | B127: Trần Hải Vưong | C127: N | D127: 84 | E127: Hưong Trà TTH | F127: 568722 | G127: Nhà | H127: 1 | I127: DLPX | J127: 6.2 | K127: 6 | L127: 15.5 | M127: 850000 | O127: TT,CN | P127: 850000 | Q127: 5 | R127: 2
A128: 119 | B128: Nguyễn thị Lài | C128: Nữ | D128: 87 | E128: Phong Điền TT Huế | F128: 814228 | G128: nhà | H128: 1 | I128: DLPX | J128: 6.7 | K128: 44.5 | L128: 17.5 | M128: 200000 | N128: 200000 | O128: LR,LR | P128: 400000 | Q128: 7 | R128: 2
A129: 120 | B129: Nguyễn văn Trung | C129: N | D129: 88 | E129: Hương Thuỷ TT H | F129: 884863 | G129: nhà | H129: 1 | I129: ĐHKH | J129: 7.4 | K129: 41.5 | L129: 21 | M129: 900000 | N129: 600000 | O129: Nề,May | P129: 1500000 | Q129: 5 | R129: 2
A130: 121 | B130: Lê thị Thu Ngân | C130: Nữ | D130: 87 | E130: Hương Trà TT H | F130: 757470 | G130: nhà | H130: 1 | I130: ĐHSP | J130: 7.9 | K130: 51 | L130: 17 | M130: 450000 | N130: 300000 | O130: CN,LR | P130: 750000 | Q130: 7 | R130: 2
A131: 122 | B131: Nguyễn thị Thanh Thuý | C131: Nữ | D131: 88 | E131: Phú Vang TTH | G131: T.527662 | H131: 1 | I131: ĐHSP | J131: 6.5 | K131: 40.5 | L131: 14.5 | M131: 400000 | N131: 300000 | O131: LR,LR | P131: 700000 | Q131: 6 | R131: 2
A132: 123 | B132: Nguyễn thị Thu Hằng | C132: Nữ | D132: 86 | E132: Phú Vang TTH | G132: T.527662 | H132: 1 | I132: DHSP | J132: 6.8 | K132: 43.5 | L132: 20 | O132: LR,LR | P132: 700000 | Q132: 6 | R132: 2
A133: 124 | B133: Nguyễn thị Như Phương | C133: nữ | D133: 88 | E133: Quảng Điền TTH | G133: T.832960 | H133: 1 | I133: DHSP | J133: 7.1 | K133: 47 | L133: 14.5 | O133: LR,LR | P133: 500000 | Q133: 6 | R133: 2
A134: 125 | B134: Huỳnh thị Nguyệt | C134: Nữ | D134: 88 | E134: Hương Thuỷ TT H | F134: 851333 | G134: nhà | H134: 1 | I134: DHSP | J134: 7 | K134: 44 | L134: 16.5 | O134: LR,LR | Q134: 6 | R134: 2
A135: 126 | B135: Trương thị Hương | C135: nữ | D135: 88 | E135: Phú Lộc TTH | F135: 822696 | G135: nhà | H135: 1 | I135: DHSP | J135: 7.5 | K135: 46.5 | L135: 18 | O135: LR,LR | P135: 450000 | Q135: 4 | R135: 2
A136: 127 | B136: Lê Huy Bảo Ngân | C136: N | D136: 88 | E136: 334 Chi lăng Tp Huế | G136: N869622 | H136: 1 | I136: DHNN | J136: 7.4 | K136: 50 | L136: 17 | O136: Vẽ,BB | P136: 700000 | Q136: 5 | R136: 2
A137: 128 | B137: Trần văn Toản | C137: N | D137: 88 | E137: Phú Lộc TTH | F137: 687435 | G137: nhà | H137: 1 | I137: DHTC | J137: 6.1 | K137: 41.5 | L137: 21 | O137: LR,LR | P137: 600000 | Q137: 7 | R137: 4
A138: 129 | B138: Lê Phi | C138: N | D138: 87 | E138: Phú Loc TTH | G138: T.821445 | H138: 1 | I138: DHSP | J138: 7.1 | K138: 40 | L138: 19.5 | O138: LR,LR | P138: 700000 | Q138: 6 | R138: 2
A139: 130 | B139: Phạm thị Nguyệt | C139: Nữ | D139: 88 | E139: Thuỷ Xuân Huế | F139: 895049 | G139: nhà | H139: 1 | I139: DHKH | J139: 7.1 | K139: 47.5 | L139: 20.5 | O139: Nề,NT | P139: 800000 | Q139: 6 | R139: 2
A140: 131 | B140: Hà thị Khánh Ly | C140: Nữ | D140: 88 | E140: Hưong Trà | G140: T881285 | H140: 1 | I140: ĐHNN | J140: 7.4 | K140: 49.5 | L140: 19.5 | O140: LR,LR | P140: 500000 | Q140: 7 | R140: 4
A141: 132 | B141: Trương Quang Nhân | C141: N | D141: 88 | E141: Hưong Tra TTH | G141: C559907 | H141: 1 | I141: ĐHY | J141: 8 | K141: 48 | L141: 23 | O141: Rèn,NT | P141: 1200000 | Q141: 8 | R141: 2
A142: 133 | B142: Trần Đăng Duy | C142: N | D142: 88 | E142: Hưong Tra TTH | F142: 825048 | G142: Nhà | H142: 1 | I142: ĐHKH | J142: 6.9 | K142: 44 | L142: 19 | O142: LR,LR | Q142: 7 | R142: 2
A143: 134 | B143: Trương Công Niêm | C143: N | D143: 86 | E143: Phú Vang | G143: C816312 | H143: 1 | I143: ĐHKH | J143: 6.7 | K143: TB | L143: 14.5 | O143: Cá,NT | Q143: 6 | R143: 2
A144: 135 | B144: Lê thị Hồng | C144: nữ | D144: 88 | E144: Phong Điền | F144: 563490 | G144: Nhà | H144: 1 | I144: ĐHKH | J144: 7.2 | K144: 42.5 | L144: 15.5 | O144: LR,LR | Q144: 5 | R144: 2
A145: 136 | B145: Trần thị Hồng Phượng | C145: nữ | D145: 88 | E145: Hưong Tra TTH | F145: 558299 | G145: Nhà | H145: 1 | I145: ĐHKT | J145: 7.4 | K145: 45.5 | L145: 18 | O145: Huu,C | P145: 750000 | Q145: 3 | R145: 2
A146: 137 | B146: Trần hiền Sơn | C146: N | D146: 87 | E146: Phú Loc TTH | F146: 873154 | G146: NHà | H146: 1 | I146: ĐHSP | J146: 7.6 | K146: 46.5 | L146: 23 | O146: BB.BB | P146: 1000000 | Q146: 5 | R146: 2
A147: 138 | B147: Nguyễn Quang Thiều | C147: N | D147: 88 | E147: 4 Phạm Hồng Thái H | F147: 512066 | G147: Nhà | H147: 1 | I147: ĐHY | J147: 8.2 | K147: 52 | L147: 24 | O147: CB.BB | P147: 2000000 | Q147: 6 | R147: 2
A148: 139 | B148: Nguyễn thị Thuỳ Giang | C148: nữ | D148: 88 | E148: Xuân PHú Huế | F148: 810237 | G148: Nhà | H148: 1 | I148: ĐHSP | J148: 8.4 | K148: 53.5 | L148: 23.5 | O148: CB.TN | P148: 2000000 | Q148: 5 | R148: 2
A149: 140 | B149: Đặng Hoài Anh | C149: N | D149: 88 | E149: Quãng Điền TTH | F149: 556242 | G149: Nhà | H149: 1 | I149: ĐHY | J149: 8.1 | K149: 51 | L149: 23.5 | O149: BB,BB | P149: 1400000 | Q149: 4 | R149: 2
A150: 141 | B150: NguyễnHữuKhánh Thiện | C150: N | D150: 88 | E150: 373/24Bùi thi Xuân H | G150: C.832483 | H150: 1 | I150: ĐHY | J150: 8 | K150: 45.5 | L150: 27.5 | O150: TT,NT | P150: 900000 | Q150: 4 | R150: 2
A151: 142 | B151: Hồ Khánh Ngọc Bích | C151: Nữ | D151: 85 | E151: 177/33 Phan Đ. Phùng H | F151: 831382 | G151: Nhà | H151: 4 | I151: ĐHKT | L151: 9.62 | O151: BB,BB | Q151: 5 | R151: 2
A152: 143 | B152: Hoàng T, Minh Hoà | C152: Nữ | D152: 88 | E152: 10/1 Tuy Lý Vưong H | F152: 820801 | G152: Nhà | H152: 1 | I152: ĐHKH | J152: 8.7 | K152: 51.5 | L152: 24 | O152: BB,BB | P152: 2000000 | Q152: 4 | R152: 2
A153: 144 | B153: Hồ thị Hoạ Mi | C153: nữ | D153: 88 | E153: 79 Lê Đại Hành | F153: 530664 | G153: Nhà | H153: 1 | I153: ĐHNN | J153: 7.9 | K153: 53 | L153: 21.5 | O153: BB,BB | P153: 3000000 | Q153: 4 | R153: 2
A154: 145 | B154: Nguyễn văn Phong | C154: N | D154: 86 | E154: Quảng Điền | F154: 814362 | G154: Nhà | H154: 1 | I154: ĐHSP | J154: 6.2 | K154: 43 | L154: 17 | O154: LR,LR | P154: 400000 | Q154: 7 | R154: 4
A155: 146 | B155: Nguyễn thị Thảo Tiên | C155: nữ | D155: 87 | E155: 1/14 Đoàn Hữu Trưng H | F155: 885200 | G155: Nhà | H155: 1 | I155: ĐHNT | J155: 71 | K155: 40.5 | L155: 26.5 | O155: GV,NT | P155: 1500000 | Q155: 7 | R155: 2
A156: 147 | B156: Phạm Công Ngữ | C156: N | D156: 88 | E156: PHú Vang | G156: T860738 | H156: 1 | I156: DLPX | J156: 6 | K156: 37.5 | L156: 15.5 | O156: CB,BB | P156: 800000 | Q156: 6 | R156: 3
A157: 148 | B157: Phan Duy Quang | C157: N | D157: 87 | E157: PHú Vang | F157: 890522 | G157: Nhà | H157: 1 | I157: DLPX | J157: 6.7 | K157: 45.5 | L157: 18 | O157: BB,BB | Q157: 6 | R157: 3
A158: 149 | B158: Nguyễn Khoa Long | C158: N | D158: 87 | E158: 27/19 Hoàng Diệu H | F158: 581554 | G158: Nhà | H158: 1 | I158: DLPX | J158: 6.8 | K158: 39.5 | L158: 16 | O158: TM,BB | P158: 500000 | Q158: 8 | R158: 5
A159: 150 | B159: Nguyễn thị Hoàng Anh | C159: nữ | D159: 87 | E159: 82 Đặng Văn Ngư H | F159: 812607 | G159: NHà | H159: 1 | I159: DLPX | J159: 6.4 | K159: 45 | L159: 13.5 | O159: XD,BB | P159: 1200000 | Q159: 6 | R159: 2
A160: 151 | B160: Nguyễn Huy Hoàng | C160: N | D160: 84 | E160: 41/9 Đào Duy Anh H | G160: c.527978 | H160: 1 | I160: ĐHNT | J160: Yếu | K160: 40.5 | L160: 33.5 | O160: HT,NT | P160: 450000 | Q160: 6 | R160: 3
A161: 152 | B161: Hà Nam Thanh | C161: N | D161: 88 | E161: 5/2 măng cá nhỏ H | F161: 522246 | G161: nhà | H161: 1 | I161: ĐHSP | J161: 7.4 | K161: 44 | L161: 21 | O161: Hưu,Hưu | P161: 2200000 | Q161: 4 | R161: 2
A162: 153 | B162: Hoàng thị Thuỳ Dương | C162: Nũ | D162: 87 | E162: Hương Trà TT H | G162: B.518358 | H162: 1 | I162: ĐHNN | J162: 6.5 | K162: 41 | L162: 12 | O162: Mộc,BB | P162: 800000 | Q162: 5 | R162: 2
A163: 154 | B163: Nguyễn văn Khánh | C163: N | D163: 88 | E163: 108 Minh Mạng H | F163: 884964 | G163: nhà | H163: 1 | I163: ĐHKH | J163: 7.6 | K163: 51 | L163: 21 | O163: BB,bb | P163: 2500000 | Q163: 5 | R163: 2
A164: 155 | B164: Phan văn Hào | C164: N | D164: 88 | E164: Phú Vang TTH | F164: 850374 | G164: nhà | H164: 1 | I164: ĐHSP | J164: 6.8 | K164: 40 | L164: 20 | O164: LR,bb | Q164: 9 | R164: 4
A165: 156 | B165: Tôn Nữ Kim Nhật | C165: nữ | D165: 88 | E165: Phú Vang TTH | F165: 859721 | G165: nhà | H165: 1 | I165: ĐHSP | J165: 7.7 | K165: 50.5 | L165: 20.5 | O165: BB,BB | P165: 1300000 | Q165: 9 | R165: 5
A166: 157 | B166: Ngô thị Mỹ Phương | C166: nữ | D166: 87 | E166: Hương Thuỷ TT H | F166: 862012 | G166: 957009002 | H166: 1 | I166: ĐHKH | J166: 7.4 | K166: 45 | L166: 17 | O166: GV,GV | P166: 2000000 | Q166: 5 | R166: 2
A167: 158 | B167: Nguyễn văn Lời | C167: N | D167: 88 | E167: Phú Lôc TTH | H167: 1 | I167: DLPX | J167: 6.17 | K167: 38.5 | L167: 13.5 | O167: LR,LR | P167: 900000 | Q167: 6 | R167: 2
A168: 159 | B168: Nguyễn Đăng Phục | C168: N | D168: 88 | E168: Phú Vang TTH | G168: C.850908 | H168: 1 | I168: ĐHKH | J168: 8.3 | K168: 46 | L168: 21 | O168: LR,BB | P168: ? | Q168: 5 | R168: 2
A169: 160 | B169: Phan thị Kim Chung | C169: nữ | D169: 86 | E169: Phú Vang TTH | F169: 850374 | G169: nhà | H169: 1 | I169: DLPX | J169: 6.8 | K169: 40.5 | L169: 15 | O169: LR,NT | Q169: 9 | R169: 3
A170: 161 | B170: Đặng thị Hoàng Oanh | C170: nữ | D170: 87 | E170: A Lưới TTH | F170: 879581 | G170: nhà | H170: 1 | I170: ĐHNN | J170: 6.3 | K170: 5.9 | L170: 14.5 | O170: CB,GV | P170: 2600000 | Q170: 6 | R170: 2
A171: 162 | B171: Phạm Công Vũ | C171: N | D171: 86 | E171: Phú Vang TTH | F171: 538793 | G171: nhà | H171: 1 | I171: ĐHNT | J171: 5.1 | K171: 38.5 | L171: 37.5 | O171: LR,LR | Q171: 5 | R171: 2
A172: 163 | B172: Phan Tâm Hải | C172: N | D172: 87 | E172: 7/122 Bạch Đằng H | F172: 534129 | G172: nhà | H172: 1 | I172: DLPX | J172: 6.3 | K172: 41.5 | L172: 13.5 | O172: ?,Vésố | Q172: 5 | R172: 1
A173: 164 | B173: Cao thị Thu Thủy | C173: nữ | D173: 87 | E173: Phú Lộc TTH | G173: C.0982873358 | H173: 1 | I173: ĐHNN | J173: 7.9 | K173: 44 | L173: 16 | O173: Già,GV | P173: 2200000 | Q173: 3 | R173: 2
A174: 165 | B174: Nguyễn văn Nhất | C174: N | D174: 87 | E174: Quảng Điền TTH | F174: 810752 | G174: nhà | H174: 1 | I174: DLPX | J174: 5.7 | K174: tb | L174: 15 | O174: Cá,PT | P174: 500000 | Q174: 6 | R174: 2
A175: 166 | B175: Nguyễn văn Pho | C175: N | D175: 85 | E175: Hương Trà TT H | F175: 550911 | G175: nhà | H175: 1 | I175: ĐHNT | J175: 4.7 | K175: 33.5 | L175: 23 | O175: LR,BB | P175: ? | Q175: 7 | R175: 3
A176: 167 | B176: Lê Phú Lộc | C176: N | D176: 86 | E176: Hương Trà TT H | H176: 1 | I176: ĐHNL | J176: 5.5 | K176: 42 | L176: 12 | O176: LR,LR | P176: 500000 | Q176: 5 | R176: 4
A177: <!-- hide this script tag's contents from old browsers function goHist(a) { history.go(a); // Go back one. } //<!-- done hiding from old browsers -->