A1: DANH SÁCH XIN CẤP HỌC BỔNG QUỐC HỌC ĐỒNG KHÁNH NAM CALI
B2: Ngày: | C2: =TODAY() -> 39179
A3: STT | B3: HỌ VÀ TÊN | C3: GIỚI TÍNH | D3: NĂM SINH | E3: CMND SỐ | F3: ĐỊA CHỈ THƯỜNG TRÚ | G3: ĐT nha | H3: ĐT LL | I3: Năm | J3: ĐẠI HỌC | K3: ĐIỂM | N3: CHA | O3: MẸ | P3: Thu nhập | Q3: Nghề Nghiep | R3: SỐ NGƯỜI GĐ | S3: Lao Động Chính | U3: Trường
K4: LỚP 12 | L4: CẤP 3 | M4: ĐẠI HỌC | T4: Hộ | U4: THPT
A5: 1 | B5: Trần Hữu An | C5: Nam | D5: 1987 | E5: 191572814 | F5: Khe Tre Nam Đông TT | H5: 2501065 | I5: 1 | J5: HV HCQG | K5: 7.2 | L5: 7.25 | M5: 17.5 | N5: Chết | O5: 300 | P5: =IF(AND(N5="chết",O5="chết"),0,IF(N5="chết",O5,IF(O5="chết",N5,N5+O5))) -> 300 | Q5: ,LR | R5: 6 | S5: 4 | T5: H.nghèo | U5: NĐ
A6: 2 | B6: Ngô quang Doanh | C6: nam | D6: 1988 | E6: 191642448 | F6: Thuỷ Dương H.Thuỷ TT | H6: T.8893507 | I6: 1 | J6: ĐHQG, Khoa Hoc | K6: 8.4 | L6: 8.5 | M6: 25.0 | N6: chết | O6: 800 | P6: =IF(AND(N6="chết",O6="chết"),0,IF(N6="chết",O6,IF(O6="chết",N6,N6+O6))) -> 800 | Q6: BB | R6: 4 | S6: 1 | T6: KK | U6: QH
A7: 3 | B7: Võ Phi Thanh | C7: Nam | D7: 1988 | E7: 191677933 | F7: Phú Hồ, Phú Vang TT,Huế | G7: 54.868417000000001 | H7: 903511776 | I7: 1 | J7: Quốc Gia XD | K7: 8.4 | L7: 8.41 | M7: 27.5 | N7: 0 | O7: 700 | P7: =IF(AND(N7="chết",O7="chết"),0,IF(N7="chết",O7,IF(O7="chết",N7,N7+O7))) -> 700 | Q7: Y.Tế | R7: 5 | S7: 2 | T7: H.nghèo | U7: 8.4
A8: 4 | B8: Huỳnh văn Dư | C8: Nam | D8: 1987 | E8: 191619122 | F8: Phú Hải Phú Vang TT Huế | G8: 54.858463 | H8: nhà | I8: 1 | J8: Quốc Gia XD | K8: 8.4 | L8: 8.0 | M8: 26.0 | N8: 800 | O8: 0 | P8: =IF(AND(N8="chết",O8="chết"),0,IF(N8="chết",O8,IF(O8="chết",N8,N8+O8))) -> 800 | Q8: Đánh Cá | R8: 6 | S8: 2 | T8: KK | U8: 8.4
A9: 5 | B9: Trần thị Ngọc Hiền | C9: Nữ | D9: 1988 | E9: 191619799 | F9: Phú Thượng Phu Vang H | G9: 54.859659000000001 | H9: 906566269 | I9: 1 | J9: Quốc Gia Kinh tế | K9: 9.3 | L9: 9.08 | M9: 27.0 | N9: 500 | O9: 500 | P9: =IF(AND(N9="chết",O9="chết"),0,IF(N9="chết",O9,IF(O9="chết",N9,N9+O9))) -> 1000 | Q9: BB,BB | R9: 5 | S9: 3 | T9: KK | U9: QH
A10: 6 | B10: Trương thị Minh Ngọc | C10: Nữ | D10: 1988 | E10: 191638514 | F10: 9 Nguỹên chí Thanh Huế | G10: 54.535279000000003 | H10: 936230205 | I10: 1 | J10: Quốc Gia Kinh tế | K10: 8.5 | L10: 9.08 | M10: 25.5 | O10: 950 | P10: =IF(AND(N10="chết",O10="chết"),0,IF(N10="chết",O10,IF(O10="chết",N10,N10+O10))) -> 950 | Q10: Huu,BB | R10: 4 | S10: 1 | T10: KK | U10: QH
A11: 7 | B11: Nguyễn Đăng Khoa | C11: Nam | D11: 1988 | E11: 191626748 | F11: 3/45Trần Nguyên Hãn H. | G11: 54.536343000000002 | H11: T.7242686 | I11: 1 | J11: ĐHBK | K11: 7.3 | L11: 8.16 | M11: 24.5 | N11: chết | P11: =IF(AND(N11="chết",O11="chết"),0,IF(N11="chết",O11,IF(O11="chết",N11,N11+O11))) -> 0 | Q11: K.Trúc | R11: 4 | S11: 1 | T11: H.nghèo | U11: QH
A12: 8 | B12: Nguyễn Thanh Huy | C12: Nam | D12: 1988 | E12: 191610821 | F12: Phú Thanh,P.Vang TT | I12: 1 | J12: ĐHBK,Hoá TP | K12: 8.2 | L12: 8.08 | M12: 24.5 | N12: 500 | O12: 500 | P12: =IF(AND(N12="chết",O12="chết"),0,IF(N12="chết",O12,IF(O12="chết",N12,N12+O12))) -> 1000 | Q12: LR,LR | R12: 6 | S12: 2 | T12: H.Nghèo | U12: QH
A13: 9 | B13: Nguyễn Tôn Việt | C13: Nam | D13: 1988 | E13: 191627022 | F13: 3/221 Nguyễn Trãi TN.Huế | G13: 54.516800 | H13: 6670176 | I13: 1 | J13: ĐHYD | K13: 8.5 | L13: 8.5 | M13: 24.0 | P13: =IF(AND(N13="chết",O13="chết"),0,IF(N13="chết",O13,IF(O13="chết",N13,N13+O13))) -> 0 | Q13: 0,GV | R13: 5 | S13: 1 | T13: KK | U13: QH
A14: 10 | B14: Nguyễn thị Minh Hoà | C14: Nữ | D14: 1988 | E14: 191617410 | F14: TT Phú Lộc,Phú Lộc TT | G14: 54.871685 | H14: 0953337347 | I14: 1 | J14: ĐHNH | K14: 8.6 | L14: 8.33 | M14: 19.5 | N14: 800 | O14: 500 | P14: =IF(AND(N14="chết",O14="chết"),0,IF(N14="chết",O14,IF(O14="chết",N14,N14+O14))) -> 1300 | Q14: CN,CN | R14: 4 | S14: 2 | T14: KK
A15: 11 | B15: Trần đình Quang Vinh | C15: Nam | D15: 1988 | E15: 191616715 | F15: 263 Tăng Bat Hổ Huế | G15: 54.518828999999997 | H15: nhà | I15: 1 | J15: HV BCVT | K15: 8.4 | L15: 7.58 | M15: 25.0 | N15: chết | O15: 200 | P15: =IF(AND(N15="chết",O15="chết"),0,IF(N15="chết",O15,IF(O15="chết",N15,N15+O15))) -> 200 | Q15: GV | R15: 5 | S15: 1 | U15: QH
A16: 12 | B16: Võ thị Như Điểm | C16: Nữ | D16: 1988 | E16: 191639300 | F16: Lộc Điền,Phú Lộc | G16: 54.873373999999998 | H16: nhà | I16: 1 | J16: Quốc Gia Kinh tế | K16: 8.4 | L16: 8.41 | M16: 19.5 | O16: 600 | P16: =IF(AND(N16="chết",O16="chết"),0,IF(N16="chết",O16,IF(O16="chết",N16,N16+O16))) -> 600 | Q16: BB | R16: 7 | S16: 3 | U16: 8.4
A17: 13 | B17: Dương thị Uyên Chi | C17: Nữ | D17: 1987 | E17: 191603984 | F17: 132 Trần Q. Toản Huế | G17: 54.525861999999996 | H17: nhà | I17: 1 | J17: ĐH Kinh Tế | K17: 7.0 | L17: 8.25 | M17: 25.0 | N17: 1200 | P17: =IF(AND(N17="chết",O17="chết"),0,IF(N17="chết",O17,IF(O17="chết",N17,N17+O17))) -> 1200 | Q17: Gò,hàn | R17: 6 | S17: 1 | T17: KK | U17: NH
A18: 14 | B18: Lê Quang Long | C18: Nam | D18: 1987 | E18: 191575728 | F18: Quảng Phu Q.Điền TT Hue | G18: 8.8325148999999996 | H18: 903068562 | I18: 1 | J18: ĐH CNTT | K18: 7.7 | L18: 7.0 | M18: 21.0 | P18: =IF(AND(N18="chết",O18="chết"),0,IF(N18="chết",O18,IF(O18="chết",N18,N18+O18))) -> 0 | Q18: Trồng trọt | R18: 5 | S18: 2 | U18: QH
A19: 15 | B19: Châu Lê Ngọc Hằng | C19: Nữ | D19: 1988 | E19: 191556611 | F19: Sơn Thuỷ A Lưới TT | H19: BĐ7242301 | I19: 1 | J19: Quốc Gia Kinh tế | K19: 9.3 | L19: 9.16 | M19: 22.0 | N19: 1500 | O19: 1450 | P19: =IF(AND(N19="chết",O19="chết"),0,IF(N19="chết",O19,IF(O19="chết",N19,N19+O19))) -> 2950 | Q19: GV,GV | R19: 5 | S19: 2 | U19: QH
A20: 16 | B20: Văn thị Kim Vui | C20: Nữ | D20: 1987 | E20: 191589094 | F20: Quảng Phước Q.Diền TT | H20: 902358422 | I20: 1 | J20: ĐHQG, Khoa Hoc | K20: 7.5 | L20: 8.25 | M20: 17.5 | N20: 800 | O20: 700 | P20: =IF(AND(N20="chết",O20="chết"),0,IF(N20="chết",O20,IF(O20="chết",N20,N20+O20))) -> 1500 | Q20: BB,BB | R20: 6 | S20: 2 | T20: KK | U20: 7.5
A21: 17 | B21: Lê Quỳnh Sơn | C21: Nam | D21: 1988 | E21: 191651498 | F21: 51 Ông ích Khiêm Huế | G21: 54.516727000000003 | H21: T.7242686 | I21: 1 | J21: ĐHBK CNTT | K21: 8.2 | L21: 8.58 | M21: 27.0 | N21: 500 | O21: 600 | P21: =IF(AND(N21="chết",O21="chết"),0,IF(N21="chết",O21,IF(O21="chết",N21,N21+O21))) -> 1100 | Q21: XD,Thêu | R21: 5 | S21: 2 | T21: KK | U21: QH
A22: 18 | B22: Nguyển văn Toàn | C22: Nam | D22: 1986 | E22: 191560264 | F22: Phước Lập Q.Phước TT | H22: A.54.55574 | I22: 1 | J22: DH GTVT | K22: 6.6 | L22: 7.41 | M22: 18.0 | P22: =IF(AND(N22="chết",O22="chết"),0,IF(N22="chết",O22,IF(O22="chết",N22,N22+O22))) -> 0 | R22: 4 | S22: 2 | T22: H.nghèo | U22: 6.6
A23: 19 | B23: Ng. Vân Khánh Quỳnh | C23: Nữ | D23: 1988 | E23: 230671583 | F23: 41 Trần K. Dư Pleiku | G23: 59.826442999999998 | H23: B.986063202 | I23: 1 | J23: ĐH Nông Lâm | K23: 8.0 | L23: 8.33 | M23: 18.0 | N23: 0 | O23: 400 | P23: =IF(AND(N23="chết",O23="chết"),0,IF(N23="chết",O23,IF(O23="chết",N23,N23+O23))) -> 400 | Q23: đan Len | R23: 6 | S23: 3 | T23: KK | U23: 8.0
A24: 20 | B24: Nguyễn phúc Thịnh | C24: Nam | D24: 1988 | E24: 191662507 | F24: Vinh Mỹ Phú Lộc TT | G24: 54.872069000000003 | H24: T.8893507 | I24: 1 | J24: BK, Điện Tử | K24: 8.5 | L24: 9.25 | M24: 25.5 | N24: 1500 | O24: 1500 | P24: =IF(AND(N24="chết",O24="chết"),0,IF(N24="chết",O24,IF(O24="chết",N24,N24+O24))) -> 3000 | Q24: GV,GV | R24: 4 | S24: 2 | T24: Xã.Nghèo | U24: QH
A25: 21 | B25: Phan Gia Minh Hoàng | C25: Nữ | D25: 1988 | E25: 191600275 | F25: TT Sịa Q.Điền TT | G25: 54.555505 | H25: B.909844004 | I25: 1 | J25: DHKT | K25: 7.6 | L25: 8.0 | M25: 20.0 | N25: chết | O25: 300 | P25: =IF(AND(N25="chết",O25="chết"),0,IF(N25="chết",O25,IF(O25="chết",N25,N25+O25))) -> 300 | Q25: LR | R25: 4 | S25: 2 | T25: KK
A26: 22 | B26: Lê Tấn Thành | C26: Nam | D26: 1988 | E26: 191600934 | F26: Xã Thuỷ An Tp Huế | G26: 54.811180 | H26: 955513696 | I26: 1 | J26: ĐHNH | K26: 8.7 | L26: 8.16 | M26: 23.0 | N26: chết | O26: 1500 | P26: =IF(AND(N26="chết",O26="chết"),0,IF(N26="chết",O26,IF(O26="chết",N26,N26+O26))) -> 1500 | Q26: GV | R26: 4 | S26: 1 | U26: QH
A27: 23 | B27: Trương văn Tân | C27: Nam | D27: 1987 | F27: Phong Chương P Điền TT | I27: 2 | J27: HV BCVT | N27: chết | P27: =IF(AND(N27="chết",O27="chết"),0,IF(N27="chết",O27,IF(O27="chết",N27,N27+O27))) -> 0 | T27: H.nghèo
A28: 24 | B28: Trần thị Thu Thanh | C28: Nữ | D28: 1988 | E28: 191552642 | F28: Quang An,Q.Điền TT | H28: 8.9845216 | I28: 1 | J28: ĐHCN | K28: 7.5 | L28: 8.1 | M28: 17.0 | N28: 400 | O28: 300 | P28: =IF(AND(N28="chết",O28="chết"),0,IF(N28="chết",O28,IF(O28="chết",N28,N28+O28))) -> 700 | Q28: LR,LR | R28: 7 | S28: 2
A29: 25 | B29: Hồ Ngọc Tín | C29: Nam | D29: 1987 | E29: 191589880 | F29: Quảng Vinh Q.Diền TT.H | I29: 2 | J29: Bách Khoa XD | P29: =IF(AND(N29="chết",O29="chết"),0,IF(N29="chết",O29,IF(O29="chết",N29,N29+O29))) -> 0 | Q29: LRuộng | R29: 6 | S29: 2 | T29: KK
A30: 26 | B30: Đặng ngọc Bảo | C30: Nam | D30: 1988 | E30: 191640289 | F30: Hương Sơ Huế | G30: 54.580458 | H30: 984198938 | I30: 1 | J30: ĐHBK | K30: 8.3 | L30: 8.58 | M30: 24.5 | N30: 1300 | O30: 800 | P30: =IF(AND(N30="chết",O30="chết"),0,IF(N30="chết",O30,IF(O30="chết",N30,N30+O30))) -> 2100 | Q30: LR,LR | R30: 4 | S30: 2 | U30: QH
A31: 27 | B31: Hồ Đăng Bảo | C31: Nam | D31: 1988 | E31: 191628598 | F31: Tứ Hạ H.Trà TT | G31: 54.815086999999998 | H31: T.8893507 | I31: 1 | J31: ĐHBK,CNTT | K31: 8.7 | L31: 9.5 | M31: 27.5 | N31: 1900 | O31: 1700 | P31: =IF(AND(N31="chết",O31="chết"),0,IF(N31="chết",O31,IF(O31="chết",N31,N31+O31))) -> 3600 | Q31: GV,GV | R31: 4 | S31: 2 | U31: QH
A32: 28 | B32: Võ Đắt Hậu | C32: Nam | D32: 1988 | E32: 191616183 | F32: 164/5 Đinh Tiên Hoàng H | G32: 54.512276999999997 | H32: 955002097 | I32: 1 | J32: BK, Điện Tử | K32: 8.1 | L32: 7.9 | M32: 25.5 | N32: 1500 | O32: 0 | P32: =IF(AND(N32="chết",O32="chết"),0,IF(N32="chết",O32,IF(O32="chết",N32,N32+O32))) -> 1500 | Q32: SC Xe máy | R32: 7 | S32: 3 | T32: KK | U32: QH
A33: 29 | B33: Cổ Kim Dũng | C33: Nam | D33: 1988 | E33: 191698952 | F33: Thuỷ Dương H.Thuỷ TT | G33: 54.864029000000002 | H33: nhà | I33: 1 | J33: ĐHBK,Hoá TP | K33: 8.9 | L33: 8.83 | M33: 27.5 | N33: 2000 | O33: 1000 | P33: =IF(AND(N33="chết",O33="chết"),0,IF(N33="chết",O33,IF(O33="chết",N33,N33+O33))) -> 3000 | Q33: GV,CN | R33: 4 | S33: 2 | U33: QH
A34: 30 | B34: Nguyễn thị Diễm Ánh | C34: Nữ | D34: 1988 | E34: 191643232 | F34: 39/1 Đặng v.Ngữ Huế | G34: 54.832338 | H34: 955597859 | I34: 1 | J34: ĐH Quốc Tế | K34: 8.6 | L34: 8.5 | M34: 22.0 | P34: =IF(AND(N34="chết",O34="chết"),0,IF(N34="chết",O34,IF(O34="chết",N34,N34+O34))) -> 0 | Q34: LòBanhMì | R34: 4 | S34: 2 | U34: QH
A35: 31 | B35: Lê Trần Thiên Hương | C35: Nữ | D35: 1988 | E35: 191643412 | F35: 139 Đặng v. Ngũ Húê | G35: 905604689 | H35: 914339184 | I35: 1 | J35: ĐHNH | K35: 8.6 | L35: 8.83 | M35: 22.0 | P35: =IF(AND(N35="chết",O35="chết"),0,IF(N35="chết",O35,IF(O35="chết",N35,N35+O35))) -> 0 | Q35: CA,BB | R35: 4 | S35: 2 | U35: QH
A36: 32 | B36: Trương thị Anh Ngân | C36: Nữ | D36: 1988 | E36: 191682746 | F36: Điền Hải P.Điền TT | G36: 54.553315 | H36: nhà | I36: 1 | J36: ĐHBK | K36: 8.6 | L36: 8.33 | M36: 24.5 | N36: 2000 | O36: 800 | P36: =IF(AND(N36="chết",O36="chết"),0,IF(N36="chết",O36,IF(O36="chết",N36,N36+O36))) -> 2800 | Q36: CơKhí,BB | R36: 8 | S36: 2 | U36: QH
A37: 33 | B37: Trần Ngọc Quý | C37: Nam | D37: 1988 | E37: `024595977 | F37: 911/22/3LLQuân Q.TB | G37: 8.8636018 | H37: nhà | I37: 1 | J37: ĐHKT | K37: 7.8 | L37: 8.58 | M37: 21.5 | P37: =IF(AND(N37="chết",O37="chết"),0,IF(N37="chết",O37,IF(O37="chết",N37,N37+O37))) -> 0 | Q37: ThợMay | R37: 7 | S37: 2
A38: 34 | B38: Phan Ngọc Tiên | C38: Nam | D38: 1987 | E38: 191604517 | F38: Hương Chử,H.Trà TT | G38: 54.557345 | I38: 2 | J38: ĐHBK | M38: 25.5 | N38: 300 | O38: 300 | P38: =IF(AND(N38="chết",O38="chết"),0,IF(N38="chết",O38,IF(O38="chết",N38,N38+O38))) -> 600 | Q38: LR,LR | R38: 8 | S38: 3
A39: 35 | B39: Tôn Nữ Cẩm Tú | C39: Nữ | D39: 1988 | E39: 191622681 | F39: 71 Nguyễn Lộ Trạch, Huế | G39: 54.811652000000002 | H39: nhà | I39: 1 | J39: ĐH Ngân Hàng | K39: 8.1 | L39: 8.5 | M39: 18.0 | N39: chết | O39: 1400 | P39: =IF(AND(N39="chết",O39="chết"),0,IF(N39="chết",O39,IF(O39="chết",N39,N39+O39))) -> 1400 | Q39: GV | R39: 5 | S39: 1 | U39: QH
A40: 36 | B40: Nguyễn Tấn Thái | C40: Nam | D40: 1988 | F40: Hương Chũ, H.Trà TT Huế | H40: Câu8829921 | I40: 1 | J40: Quốc Gia TL | K40: 6.2 | L40: 7.33 | M40: 17.5 | N40: 350 | O40: 300 | P40: =IF(AND(N40="chết",O40="chết"),0,IF(N40="chết",O40,IF(O40="chết",N40,N40+O40))) -> 650 | Q40: L.Ruộng | R40: 6 | S40: 2 | U40: 6.2
A41: 37 | B41: Trần thị Hằng | C41: Nữ | D41: 1988 | E41: 191638352 | F41: 17 Chế Lan Viên Huế | G41: 54.832132000000001 | H41: T.8964214 | I41: 1 | J41: ĐHNH | K41: 8.9 | L41: 8.5 | M41: 21.5 | N41: 1400 | O41: 0 | P41: =IF(AND(N41="chết",O41="chết"),0,IF(N41="chết",O41,IF(O41="chết",N41,N41+O41))) -> 1400 | Q41: Huu | R41: 5 | S41: 2 | U41: QH
A42: 38 | B42: Nguyễn văn Nam | C42: Nam | D42: 1985 | E42: 191562011 | F42: Lộc Thuỷ Phú Lộc Huế | H42: 989307642 | I42: 2 | J42: DHDL Văn Lang | L42: 5.9 | N42: 900 | P42: =IF(AND(N42="chết",O42="chết"),0,IF(N42="chết",O42,IF(O42="chết",N42,N42+O42))) -> 900 | Q42: Thú Y | R42: 6 | S42: 3
A43: 39 | B43: Hà thị Mỹ Hạnh | C43: Nữ | D43: 1987 | E43: 191590778 | F43: 465 Chi Lăng Huế | G43: 54.534455000000001 | H43: 8461811 | I43: 2 | J43: ĐHKT | K43: 8.7 | L43: 8.9 | N43: 1500 | O43: 600 | P43: =IF(AND(N43="chết",O43="chết"),0,IF(N43="chết",O43,IF(O43="chết",N43,N43+O43))) -> 2100 | Q43: TàiXế, bb | R43: 10 | S43: 3 | T43: KK | U43: QH
A44: 40 | B44: Nguyển Xuân Thành | C44: Nam | D44: 1987 | E44: `024050982 | F44: 1737a2Hồng Lạc TB HCM | G44: 8.8647455 | H44: nhà | I44: 1 | J44: ĐHBK | K44: 8.5 | L44: 9.0 | M44: 24.0 | N44: 2000 | O44: 0 | P44: =IF(AND(N44="chết",O44="chết"),0,IF(N44="chết",O44,IF(O44="chết",N44,N44+O44))) -> 2000 | Q44: Thợ May | R44: 7 | S44: 1
A45: 41 | B45: Huỳnh thị Ánh Hằng | C45: Nữ | D45: 1987 | E45: `024594812 | F45: 1/26/2 Hồng Lạc P10 TB | G45: 918297305 | H45: 9716886 | I45: 1 | J45: ĐHYD | K45: 8.9 | L45: 9.42 | M45: 24.5 | O45: 1500 | P45: =IF(AND(N45="chết",O45="chết"),0,IF(N45="chết",O45,IF(O45="chết",N45,N45+O45))) -> 1500 | Q45: ?,BB | R45: 4 | S45: 1
A46: 42 | B46: Phan Cảnh Tân | C46: Nam | D46: 1988 | E46: 191612441 | F46: Q.Phước Q.Điền TT | H46: D.909975396 | I46: 1 | J46: ĐHKT | K46: 7.1 | L46: 7.55 | M46: 22.25 | P46: =IF(AND(N46="chết",O46="chết"),0,IF(N46="chết",O46,IF(O46="chết",N46,N46+O46))) -> 0 | Q46: Y.Sỉ,LR | R46: 5 | S46: 2
A47: 43 | B47: Đặng thị Thu Tâm | C47: Nữ | D47: 1988 | E47: 191600386 | F47: TT Sia Q.Điền TT | G47: 54.555053 | H47: 8442351 | I47: 1 | J47: ĐHKT | K47: 6.8 | L47: 7.75 | M47: 17.5 | N47: 1000 | O47: 900 | P47: =IF(AND(N47="chết",O47="chết"),0,IF(N47="chết",O47,IF(O47="chết",N47,N47+O47))) -> 1900 | Q47: BB,BB | R47: 6 | S47: 2
A48: 44 | B48: Trần Quốc Dũng | C48: Nam | D48: 1983 | E48: 191514121 | F48: Lộc Bổn Phú Lộc TT | H48: 0908981093 | I48: 5 | J48: ĐH Kiến Trúc | N48: chết | O48: 1500 | P48: =IF(AND(N48="chết",O48="chết"),0,IF(N48="chết",O48,IF(O48="chết",N48,N48+O48))) -> 1500 | Q48: ,BB | R48: 6 | S48: 3 | T48: Có Y/K cua Hũư
A49: 45 | B49: Lê Thành Lợi | C49: Nam | D49: 1988 | E49: 191624651 | F49: 911/22/9 LacL.Quân TB | G49: 8.8659584 | H49: nhà | I49: 1 | J49: ĐHBK | K49: 7.6 | L49: 7.33 | M49: 17.5 | P49: =IF(AND(N49="chết",O49="chết"),0,IF(N49="chết",O49,IF(O49="chết",N49,N49+O49))) -> 0 | Q49: TM,Tmay | R49: 6 | S49: 2
A50: 46 | B50: Lê Đức Tài | C50: Nam | D50: 1988 | E50: 285144961 | F50: Tân Xuân Đồng Xoài B.Phước | G50: 651.881792 | H50: nhà | I50: 1 | J50: DHSPKT | K50: 7.6 | L50: 8.2 | M50: 23.0 | N50: 1500 | P50: =IF(AND(N50="chết",O50="chết"),0,IF(N50="chết",O50,IF(O50="chết",N50,N50+O50))) -> 1500 | Q50: GV,NT | R50: 5 | S50: 1
A51: 47 | B51: Nguyễn thị Thanh Thảo | C51: Nữ | D51: 1987 | E51: 191582935 | F51: P.Lập Q.Phước TT | H51: A.914352194 | I51: 1 | J51: CD KTCN Đ.Nai | K51: 6.3 | L51: 5.6 | M51: 9.5 | N51: 600 | O51: 300 | P51: =IF(AND(N51="chết",O51="chết"),0,IF(N51="chết",O51,IF(O51="chết",N51,N51+O51))) -> 900 | Q51: D.Cá,D.Cá | R51: 7 | S51: 2 | U51: 6.3
A52: 48 | B52: Phạm Phú Quốc | C52: Nam | D52: 1988 | E52: 191623535 | F52: Phú Bài H.Thuỷ TT | G52: 54.863917999999998 | H52: T.8893507 | I52: 1 | J52: ĐHBK, Hoá TP | K52: 8.9 | L52: 8.08 | M52: TT | N52: 700 | O52: 1000 | P52: =IF(AND(N52="chết",O52="chết"),0,IF(N52="chết",O52,IF(O52="chết",N52,N52+O52))) -> 1700 | Q52: CôngNhân | R52: 4 | S52: 2 | U52: QH
A53: 49 | B53: Lê Nguyễn Tuỳ Duyên | C53: Nữ | D53: 1988 | E53: 191626727 | F53: 113 Thạch Hãn Huế | G53: 54.538392000000002 | H53: 955122007 | I53: 1 | J53: ĐHKT | K53: 9.1 | L53: 8.8 | M53: 21.0 | N53: 1600 | O53: 800 | P53: =IF(AND(N53="chết",O53="chết"),0,IF(N53="chết",O53,IF(O53="chết",N53,N53+O53))) -> 2400 | Q53: KsXD,bb | R53: 4 | S53: 2 | U53: QH
A54: 50 | B54: Tôn Nữ Thảo Uyên | C54: Nữ | D54: 1987 | E54: 191634526 | F54: 90 Ông Ich Khiêm Huế | G54: 054.512692 | H54: 0983399467 | I54: 1 | J54: ĐHDL Hồng Bàng | K54: 6.1 | L54: 5.0 | M54: 16.0 | P54: =IF(AND(N54="chết",O54="chết"),0,IF(N54="chết",O54,IF(O54="chết",N54,N54+O54))) -> 0 | Q54: LD,BB | R54: 5 | S54: 2 | T54: KK
A55: 51 | B55: Đoàn ngọc Như Quynh | C55: Nữ | D55: 1986 | E55: 191559307 | F55: Vinh Xuân Phú Vang H | G55: 54.858809000000001 | H55: nhà | I55: 1 | J55: ĐH Ngân Hàng | K55: 6.8 | M55: 19.0 | N55: 1200 | O55: 1000 | P55: =IF(AND(N55="chết",O55="chết"),0,IF(N55="chết",O55,IF(O55="chết",N55,N55+O55))) -> 2200 | Q55: GV,GV | R55: 6 | S55: 2 | U55: 6.8
A56: 52 | B56: Hồ nhất Văn | C56: Nam | D56: 1987 | E56: 191615255 | F56: 59/1 Lý Nam Đế Huế | G56: 54.510938000000003 | H56: A.9120323 | I56: 1 | J56: DH GTVT | K56: 6.2 | L56: 6.08 | M56: 13.0 | P56: =IF(AND(N56="chết",O56="chết"),0,IF(N56="chết",O56,IF(O56="chết",N56,N56+O56))) -> 0 | Q56: TT,TTrọt | R56: 7 | S56: 1 | U56: 6.2
A57: 53 | B57: Ng.công nữ ThuỳDung Dung | C57: Nữ | D57: 1988 | E57: 191672903 | F57: 85/3An dương Vương H. | G57: 54.847209 | H57: T.8964214 | I57: 1 | J57: ĐHNH | K57: 8.3 | L57: 7.83 | M57: 23.5 | N57: 2000 | O57: 1000 | P57: =IF(AND(N57="chết",O57="chết"),0,IF(N57="chết",O57,IF(O57="chết",N57,N57+O57))) -> 3000 | Q57: CA,Ytế | R57: 5 | S57: 3 | U57: QH
A58: 54 | B58: Hồ khánh Hải Thuận | C58: Nam | D58: 1987 | E58: 191608761 | F58: 33/177 P.đình Phùng Huế | G58: 54.831381999999998 | H58: 903068562 | I58: 2 | J58: SPKT | K58: 8.1 | P58: =IF(AND(N58="chết",O58="chết"),0,IF(N58="chết",O58,IF(O58="chết",N58,N58+O58))) -> 0 | Q58: BB.BB | S58: 2 | U58: QH
A59: 55 | B59: Huỳnh Thuý Trân | C59: Nữ | D59: 1987 | E59: `024071219 | F59: 130/30Ngyễn V. Luông Q.6 | I59: 1 | J59: ĐHSP | K59: 7.7 | L59: 7.0 | M59: 18.0 | N59: 2500 | O59: 1000 | P59: =IF(AND(N59="chết",O59="chết"),0,IF(N59="chết",O59,IF(O59="chết",N59,N59+O59))) -> 3500 | Q59: CN,CN | R59: 5 | S59: 2
A60: 56 | B60: Trịnh N. Đông Hà | C60: Nữ | D60: 1987 | E60: 191608402 | F60: 3/2 đưòng 68 Huế | G60: 54.522770000000001 | H60: C.908141573 | I60: 2 | J60: GTVT | P60: =IF(AND(N60="chết",O60="chết"),0,IF(N60="chết",O60,IF(O60="chết",N60,N60+O60))) -> 0 | Q60: GV,GV | S60: 3
A61: 57 | B61: Hà Thúc Nguyên | C61: Nam | D61: 1987 | E61: 191590970 | F61: 2/209 Đào Duy Anh, Phú Bình | H61: 08.8531882 | I61: 2 | N61: 0 | O61: 0 | P61: 0 | Q61: chết, MSLĐ | T61: KK
A62: <!-- hide this script tag's contents from old browsers function goHist(a) { history.go(a); // Go back one. } //<!-- done hiding from old browsers -->