A1: BÁO CÁO CỘNG DỒN ủng hộ của các nhà hảo tâm
A2: Quý I, 2008
A3: Ngày báo cáo 11/06/2008
A4: Phần Thu
A5: Mã số thứ tự | B5: Diễn Giải | C5: THU | E5: Tỷ giá | F5: Tổng
C6: VNĐ | D6: USD | F6: Qui ra VNĐ
A7: 1 | B7: Gia đình Thầy Lê Hiếu Kính (Lê Hiếu Nghĩa,Lê Hiếu Liêm,Lê Hiếu Hoà,Lê Hiếu Hữu,Lê Hiếu Nhân,Lê Thị Hiếu Thảo,Lê Thị Hiếu Hạnh,Lê Hiếu Ðễ) ủng hộ học bổng (15,000,000 đ) và xây dựng Lai Thành (15,000,000 đ) | C7: 30000000 | F7: 30000000
A8: 2 | B8: Anh Lê Văn Thân, Chủ Tịch HĐ Thành Viên Cty TNHH TK-XD-TM Thiên An ủng hộ xây dựng Lai Thành | C8: 20000000 | F8: 20000000
A9: 8 | B9: Anh Chị Hồ Xuân Thiên Ở An Giang ủng hộ 30 HB cấp 1 và 1 triệu ủng hộ xây dựng Lai Thành | C9: 10000000 | F9: 10000000
A10: 10 | B10: Bán 900 cổ phiếu của CTY Hoà Bình và gia đình Thầy Lê Mộng Đào( 82,060,000 đ) đế cấp hb sinh viên và học sinh cấp 2 ở Huế , ủng hộ xây dựng Lai Thành 30,000,000 đ | C10: 112060000 | F10: 112060000
A11: 11 | B11: Chị Lê Thị Thu Hồng, Tiến Sĩ ở Viện Cây Ăn Quả miền Nam;Tiền Giang | C11: 2000000 | F11: 2000000
A12: 13 | B12: Anh Nguyễn Thanh Trung, Giám đốc CTy Tôn Đông Á ủng hộ xây dựng Lai Thành, học bổng sinh viên | C12: 20000000 | F12: 20000000
A13: 14 | B13: Anh Nguyễn Quốc Khánh ủng hộ HB sinh viên học sinh ở Huế | C13: 10000000 | F13: 10000000
A14: 15 | B14: Anh Nguyễn Quốc Hiến ủng hộ học bổng sinh viên | C14: 1000000 | F14: 1000000
A15: 16 | B15: Hội Ái Hữu Quốc Học-Đồng Khánh Nam Cali -Hoa Kỳ ủng hộ học bổng trong đó : | D15: 6820 | E15: 15840 | F15: =D15*E15 -> 108028800
A16: 16 | B16: Chị Nguyễn Kim Oanh, cựu học sinh Thành Nội ở Hoa Kỳ 10,000,000 đ
A17: 16 | B17: Cô Phan Thùy ở Hoa Kỳ 2,000,000 đ
A18: 16 | B18: Cty Anh Minh ở California, Hoa Kỳ 4,000,000 đ
A19: 16 | B19: Anh Lê Như Duy ở Hoa Kỳ 3,000,000 đ
A20: 20 | B20: Anh chị Lê Văn Dũng ủng hộ xây dựng Lai Thành | C20: 3000000 | F20: 3000000
A21: 22 | B21: Cty Minh Trung ( anh Hòang Văn Minh) ủng hộ HB sinh viên | C21: 5000000 | F21: 5000000
A22: 24 | B22: Cty Hoàng Việt (anh chị Võ Mỹ Hương và Lê Xuân Thìn ) ủng hộ chi phí họat động | C22: 1000000 | F22: 1000000
A23: 27 | B23: Chị Lê Thị Thu Thạnh, DNTN Phú Thạnh ở TPHCM | C23: 1000000 | F23: 1000000
A24: 37 | B24: Tiến sĩ , bác sĩ Lê Hành ở TPHCM ủng hộ HB sinh viên | C24: 2000000 | F24: 2000000
A25: 61 | B25: Anh Dương Học Minh ủng hộ HB sinh viên ở TPHCM | C25: 5000000 | F25: 5000000
A26: 102 | B26: Hội Ái Hữu Quốc Học-Đồng Khánh nam Cali -Hoa Kỳ, Hội Thân Hữu Huế, hội đồng Hòang tộc Nguyễn Phúc ở Hoa Kỳ cứu trợ bão lụt đợt 3 | D26: 1000 | E26: 15984 | F26: =D26*E26 -> 15984000
A27: 126 | B27: Ông Bà Võ Đình Hữu xây trường Lai Thành đợt 4&5 | D27: 10000 | E27: 15840 | F27: =D27*E27 -> 158400000
A28: 135 | B28: Bác sĩ Phạm Văn Căn ủng hộ HB sinh viên Y Dược ở Huế | C28: 3000000 | F28: 3000000
A29: 136 | B29: BS Phan Tiết Hồng Minh ở TPHCM ủng hộ HB sinh viên và hồi ký thầy Lê Hiếu Kính | C29: 4200000 | F29: 4200000
A30: 137 | B30: Hội Ái Hữu Nông Lâm Súc Huế ủng hộ học bổng sinh viên ở TPHCM | C30: 5000000 | F30: 5000000
A31: 138 | B31: Nhiếp ảnh gia Đào Hoa Nữ (PT 63/2/08) ủng hộ HB sinh viên | C31: 5000000 | F31: 5000000
A32: 139 | B32: Ông Allan Bruce bạn CTY Hoàng Việt (PT 68/2/08) ủng hộ chi phí họat động | D32: 300 | F32: 4800000
A33: 140 | B33: Ông Hồng Cao ở Quận 5,TPHCM tặng em Nguyễn Minh Tấn, học sinh giỏi Quốc Học , Anh Nam vận động | C33: 5000000 | F33: 5000000
A34: 141 | B34: Anh Nguyễn Văn Ngân , cựu học sinh Quốc Học ở Hoa Kỳ | D34: 50 | E34: 15952 | F34: =D34*E34 -> 797600
A35: 142 | B35: Anh Võ Đại Phúng, cựu học sinh Nông Lâm Súc ở TPHCM | C35: 500000 | F35: 500000
A36: 143 | B36: Anh Chị Trần Bá Tuấn, cựu học sinh Hàm Nghi, Cty Hòang Kim ở TPHCM ủng hộ xây dựng Lai Thành | C36: 10000000 | F36: 10000000
B37: Tổng kết THU quý I-2008 | C37: =SUM(C7:C36) -> 254760000 | D37: =SUM(D7:D36) -> 18170 | F37: =SUM(F7:F36) -> 542770400
B39: Tổng kết THU đến 31-12-2007 | F39: 1646772900
B41: Tổng kết THU đến 31-03-2008 | F41: =SUM(F37:F39) -> 2189543300