A2: BÁO CÁO TÌNH HÌNH DỰ TÓAN THU CHI CỦA CÔNG TRÌNH TRƯỜNG TIỂU HỌC 3 LỚP PHÚ XUÂN 2
A3: Ngày báo cáo 31/08/2008
A4: Diễn giải phần THU | B4: THU | D4: Tỷ giá | E4: Tổng
B5: VNĐ | C5: USD | E5: Qui ra VNĐ
A6: Cô Phan Thị Hiền Viên, cựu giáo sư Đồng Khánh, ở Hoa Kỳ | C6: 18000 | D6: 16800 | E6: =C6*D6 -> 302400000
A7: Anh chị Nguyễn Trọng Tư, quê ngoại ở Diên Đại, ở ở Hoa Kỳ | C7: 50 | D7: 16250 | E7: =C7*D7 -> 812500
A8: CTY Tôn Đông Á ( anh Nguyễn Thanh Trung) ủng hộ tôn và tiền mặt | B8: 50000000 | E8: =IF(B8>1,B8,IF(C8>1,C8*D8," ")) -> 50000000
A9: Anh Lê Minh Giám, Cơ sở Nhật Nguyên ở TPHCM | B9: 12000000 | E9: 12000000
A10: Anh Nguyễn Quốc Khánh, Giám đốc Cty XD-TM-TK Thiên An ở TPHCM | B10: 5000000 | E10: 5000000
A11: Cty TNHH XD-TM-TK Thiên An ở TPHCM | B11: 20000000 | E11: 20000000
A12: Gia đình Thầy Lê Hiếu Kính | B12: 10000000 | E12: 10000000
A13: Bà Phạm Thị Sáo ( mẹ của Thu Hồng, Thu Thạnh…) ở TPHCM | B13: 5000000 | E13: 5000000
A14: Nhóm nữ sinh Đồng Khánh ( Liên Hương, Bích Hà, Thu Thảo, Diệu Phương) | B14: 2200000 | E14: 2200000
A15: Anh Trần Lý, Giám đốc Cty Xây Dựng Trường Tiền ở TPHCM | B15: 1000000 | E15: 1000000
A16: Một nhà hảo tâm ẩn danh ở TPHCM | B16: 10000000 | E16: 10000000
A17: Cô Nguyễn ở TPHCM ủng hộ trang bị bàn ghế 1 phòng học | B17: 16240000 | E17: 16240000
A18: Sơ kết THU | B18: =SUM(B6:B17) -> 131440000 | C18: =SUM(C6:C17) -> 18050 | E18: =SUM(E6:E17) -> 434652500
A20: Chi phí xây dựng và trang bị trường Phú Xuân 2 như sau :
A21: Diễn giải phần CHI | E21: Tổng
E22: Qui ra VNĐ
A23: Hợp đồng với CTy Hưng Thịnh :(bao gồm phần xây dựng có điện nước, tôn lợp Cty Tôn Đông Á cấp ) | E23: 437805000
A24: Phần tôn Cty Tôn Đông Á cấp theo y/c là | E24: 24000000
A25: Phần đóng trần tôn lạnh | E25: 27000000
A26: Chi phí Giám sát | E26: 5000000
A27: Trang thiết bị bàn ghế 1 phòng học | E27: 16240000
A28: Hệ thống điện đâu nối vào đến công trình | E28: 6500000
A29: Hệ thống nước đâu nối vào đến công trình | E29: 5000000
A30: Làm bảng hiệu Trường | E30: 1250000
A31: Tổng dự tóan CHI | E31: =SUM(E23:E30) -> 522795000
A34: Chệch lệch dự tóan cần THU | E34: =E18-E31 -> -88142500