A1: QUỸ GIÁO DỤC "HUẾU HIẾU HỌC"
B3: DANH SÁCH 10 SINH VIÊN ĐƯỢC XÉT
B4: NĂM HỌC 2006-2007
B6: S TTHS | C6: HỌ VÀ TÊN | E6: Giới tính | F6: Năm sinh | G6: CMND | H6: Địa chỉ thường trú | I6: ĐT nhà | J6: SV năm thứ | K6: Tên trường ĐH | L6: Điểm
A7: STT | L7: Lớp 12 | M7: TN cấp 3 | N7: Đại Học | O7: Thu nhập | P7: Thu nhập | Q7: Hoc Luc TB
A8: 1G | B8: 142 | C8: Hồ Khánh Ngọc | D8: Bích | E8: Nữ | F8: 85 | H8: 33/177 Phan Dinh Phung H | I8: 831382 | J8: 4 | K8: ĐHKT | N8: Giỏi | Q8: 9.84
A9: 2G | B9: 85 | C9: Nguyễn Duy Nam | D9: Anh | E9: N | F9: 32275 | H9: Hương Thuỷ | I9: 854952 | J9: 1 | K9: ĐHY | L9: 8.7 | M9: 54 | N9: 23 | O9: 1500000 | P9: 1500000 | Q9: =(L9+M9+N9)/10 -> 8.57
A10: 3G | B10: 139 | C10: Nguyễn thị Thuỳ | D10: Giang | E10: nữ | F10: 88 | H10: Xuân PHú Huế | I10: 810237 | J10: 1 | K10: ĐHSP | L10: 8.4 | M10: 53.5 | N10: 23.5 | Q10: =(L10+M10+N10)/10 -> 8.54
A11: 4G | B11: 138 | C11: Nguyễn Quang | D11: Thiều | E11: N | F11: 88 | H11: 4 Phạm Hồng Thái H | I11: 512066 | J11: 1 | K11: ĐHY | L11: 8.2 | M11: 52 | N11: 24 | Q11: =(L11+M11+N11)/10 -> 8.42
A12: 5G | B12: 143 | C12: Hoàng T, Minh | D12: Hoà | E12: Nữ | F12: 88 | H12: 10/1 Tuy Lý Vưong H | I12: 820801 | J12: 1 | K12: ĐHKH | L12: 8.7 | M12: 51.5 | N12: 24 | Q12: =(L12+M12+N12)/10 -> 8.42
A13: 6G | B13: 144 | C13: Hồ thị Hoạ | D13: Mi | E13: nữ | F13: 88 | H13: 79 Lê Đại Hành | I13: 530664 | J13: 1 | K13: ĐHNN | L13: 7.9 | M13: 53 | N13: 21.5 | Q13: =(L13+M13+N13)/10 -> 8.24
A14: 7G | B14: 83 | C14: Nguyễn thị Minh | D14: Thành | E14: nữ | F14: 32391 | H14: Phong Điền | I14: 581037 | J14: 1 | K14: ĐHY | L14: 8.5 | M14: 48 | N14: 24 | O14: 1500000 | P14: 1500000 | Q14: =(L14+M14+N14)/10 -> 8.05
A15: 8G | B15: 154 | C15: Nguyễn văn | D15: Khánh | E15: N | F15: 88 | H15: 108 Minh Mạng H | I15: 884964 | J15: 1 | K15: ĐHKH | L15: 7.6 | M15: 51 | N15: 21 | Q15: =(L15+M15+N15)/10 -> 7.96
A16: 9G | B16: 87 | C16: Hồ Đắc Thiện | D16: Tân | E16: N | F16: 31927 | H16: Phú Vang | I16: 850839 | J16: 1 | K16: ĐHKH | L16: 8 | M16: 49.5 | N16: 21 | O16: 1000000 | P16: 1000000 | Q16: =(L16+M16+N16)/10 -> 7.85
A17: 10G | B17: 78 | C17: Phạm Nguyên Tuấn | D17: Hải | E17: N | F17: 32256 | H17: 2/592 Lê Duẩn | I17: 580699 | J17: 1 | K17: ĐHSP | L17: 8.4 | M17: 50 | N17: 20 | O17: 600000 | P17: 1200000 | Q17: =(L17+M17+N17)/10 -> 7.84
H21: Hội Đồng Xét Duyệt ngày 04 tháng 04 năm 2007
H22: Trưởng Ban Xét Duyệt Học Bổng
I24: Bảo An