B3: DANH SÁCH SINH VIÊN cac Trường CĐ HUẾ
A4: HỌC BỔNG Thầy ĐINH HOÀ
B6: NĂM HỌC 2007-2008
A8: S TTHS | B8: HỌ | C8: TÊN | D8: GT/N | E8: Năm sinh | F8: MSSV | G8: CMND | H8: Địa chỉ thường trú | I8: DT liênlạc | J8: SV năm thứ | K8: Điểm | O8: N/N | P8: Thu Nhập | Q8: SN/LD
K9: Lớp 12 | L9: TN cấp 3 | M9: Đại Học | N9: vào ĐH | O9: Cha/Me
A10: 1 | B10: Nguyễn Đình | C10: Thành | E10: 87 | G10: 191598394 | H10: Thủy Phương, H Thủy Huế | I10: 822893 | J10: 2 | K10: 7.0 | N10: 7.5 | O10: LR/LR | P10: 750000 | Q10: 7/1
A11: 2 | B11: Trần Đình Ngọc | C11: Mỹ | E11: 87 | G11: 191604755 | H11: Tứ Hạ, Hương Trà Huế | I11: 567529 | J11: 2 | K11: 6.5 | N11: 11 | O11: LR/bb | P11: 2800000 | Q11: 4/3
A12: 3 | B12: Bùi Văn | C12: Hùng | E12: 89 | G12: 191661362 | H12: 22/7 Phú Mộng Kim Long H | I12: 519465 | J12: 12 | O12: Thợ/bb | P12: 900000 | Q12: 8/2 | R12: Cô Giáo gt
A13: 4 | B13: Phan Thanh | C13: Tuấn | E13: 88 | G13: 191635307 | H13: 38 Đào Tấn P.Trường An Huế | I13: 826934 | J13: K02THA1 | K13: 6.5 | L13: =41/6 -> 6.833333333333333 | N13: 19.5 | O13: LR/LR | Q13: 4/1 | R13: Thiếu HS
A14: 5 | B14: Nguyễn Văn | C14: Cường | E14: 86 | G14: 191593764 | H14: Lộc Điền Phú Lộc | J14: k02OTA1 | K14: 6.4 | N14: 19 | O14: LR/Chết | Q14: 2/1
A15: 6 | B15: Trấn Văn | C15: Sơn | E15: 88 | G15: 191621606 | H15: Mỹ Xuyên,Phong Háo,P.Điền | J15: K02DCA2 | L15: =38.5/6 -> 6.416666666666667 | N15: 18.75 | O15: chết/LR | Q15: 4/1 | R15: thiếu HS
A16: 7 | B16: Nguyễn | C16: Tươi | E16: 87 | G16: 191711876 | H16: Vinh Thanh,Phú vang | J16: K02NLA1 | L16: =32.5/6 -> 5.416666666666667 | N16: 19.5 | O16: LR/LR | Q16: 4/1 | R16: thiếu HS
A17: 8 | B17: Nguyễn Văn | C17: Duy | E17: 87 | G17: 191615032 | H17: 90/3 Phạm Thị Liên Huế | J17: K02DCA2 | N17: 18.5 | O17: ?/già | Q17: 2/1 | R17: thiếu HS
A18: 9 | B18: Hồ Dư | C18: Thanh | E18: 89 | G18: 191629209 | H18: QuangPhước,Quảng Điền | I18: 978006603 | J18: K02THA1 | K18: 6.5 | L18: =35.5/6 -> 5.916666666666667 | N18: 18 | O18: LR/LR | Q18: 4/1 | R18: thiếu HS
A19: 10 | B19: Lê Phước | C19: Thạnh | E19: 89 | G19: 191707333 | H19: TT Phú Lộc,P.Lộc | J19: K02DCA1 | K19: 6.8 | L19: =40/6 -> 6.666666666666667 | N19: 18 | O19: LR/LR | P19: 1000000 | Q19: 6/2 | R19: thiếu HS
A20: 11 | B20: Nguyễn Văn | C20: Phanh | E20: 86 | G20: 191639742 | H20: Vinh Hưng,Phú Lộc | I20: 815943 | J20: K02DTA1 | K20: 6.4 | L20: =43.5/6 -> 7.25 | N20: 18.5 | O20: LR/LR | P20: 1200000 | Q20: 8/3 | R20: thiếu HS
A21: 12 | B21: Trần Trọng | C21: Đại | E21: 89 | G21: 191680130 | H21: Lộc Sơn,Phú Lộc | J21: K02NLA1 | L21: =34/6 -> 5.666666666666667 | N21: 19 | O21: LR/LR | P21: 600000 | Q21: 7/1 | R21: thiếu HS
A22: 13 | B22: Hồ Dình | C22: Lợi | E22: 89 | G22: 191654549 | H22: Phú Xuan,Phú vang | J22: K020TA1 | K22: 7.5 | L22: =34.5/6 -> 5.75 | M22: 150000 | N22: 20 | O22: LR/LR | P22: 700000 | Q22: 6/1 | R22: thiếu HS
A23: 14 | B23: Dụng | C23: Chánh | E23: 88 | H23: Vinh Thanh,Phú Vang | J23: K02THA1 | P23: Hộ Nghèo
A24: 15 | B24: Trương Thị | C24: Thủy | D24: x | E24: 89 | H24: Quảng Thành, Q.Điền | J24: K02KTA01 | P24: Hộ Nghèo
A25: 16 | B25: Lê Văn | C25: Thìn | E25: 89 | H25: Cư Chánh Thủy bằng H.Thủy | J25: T10DCA2 | P25: Mồ Côi
A26: 17 | B26: Nguyễn Văn | C26: Hai | E26: 91 | H26: 140 Nguyễn Trãi (nhà TEKK) | J26: C33DCB2 | P26: Mồ Côi
A27: 18 | B27: Nguyễn Đình | C27: Thanh | E27: 88 | H27: Vĩnh Thái P.Vang | J27: K02NLA1 | P27: Hộ Nghèo
A28: 19 | B28: Hoàng Trọng | C28: Viên | E28: 90 | H28: TTBT trẻ em Xuân Phú | J28: T09OTB1 | P28: Mồ Côi
A29: 20 | B29: Cao Chánh | C29: Hỷ | E29: 83 | H29: Điền Hải,Phong Điền | J29: T10KTA1 | P29: Hộ Nghèo
A30: 21 | B30: Cao Đình | C30: Thành | E30: 91 | H30: Thanh Chi, Huơng An | J30: C34DCB2 | P30: Hộ Nghèo
A31: 22 | B31: Nguyễn Công | C31: Ban | E31: 88 | H31: Vinh Thanh,Phú vang | J31: K02CKA2 | P31: Hộ Nghèo
A32: 23 | B32: Nguyễn Hồng | C32: Quảng | E32: 99 | H32: Phú An, Phú Vang | J32: C34DCB2 | P32: Hộ Nghèo
A33: 24 | B33: Nguyễn Hồng | C33: Thế | E33: 88 | H33: Sơn Trạch Bố Trạch Q.Bình | J33: T09DCA2 | P33: Mồ Côi
A34: 25 | B34: Phan | C34: Chuân | E34: 90 | H34: TTBT trẻ em Xuân Phú | J34: T09OTB1 | P34: Mồ Côi